created_at,favorite_count,id_str,in_reply_to_user_id_str,retweet_count,source,text,,,,
Sun Aug 05 20:01:17 +0000 2018,135598,1.0262E+18,NULL,29214,Twitter for iPhone,"Presidential Approval numbers are very good - strong economy\, military and just about everything else. Better numbers than Obama at this point\, by far. We are winning on just about every front and for that reason there will not be a Blue Wave\, but there might be a Red Wave!",,,,
Sun Aug 05 12:49:21 +0000 2018,93211,1.02609E+18,NULL,22057,Twitter for iPhone,Too bad a large portion of the Media refuses to report the lies and corruption having to do with the Rigged Witch Hunt - but that is why we call them FAKE NEWS!,,,,
Sun Aug 05 12:45:56 +0000 2018,104190,1.02609E+18,NULL,26382,Twitter for iPhone,"...Why aren’t Mueller and the 17 Angry Democrats looking at the meetings concerning the Fake Dossier and all of the lying that went on in the FBI and DOJ? This is the most one sided Witch Hunt in the history of our country. Fortunately\, the facts are all coming out\, and fast!",,,,
Sun Aug 05 12:35:43 +0000 2018,83174,1.02608E+18,NULL,20549,Twitter for iPhone,"Fake News reporting\, a complete fabrication\, that I am concerned about the meeting my wonderful son\, Donald\, had in Trump Tower. This was a meeting to get information on an opponent\, totally legal and done all the time in politics - and it went nowhere. I did not know about it!",,,,
Sun Aug 05 12:06:25 +0000 2018,81856,1.02608E+18,NULL,19789,Twitter for iPhone,"..Because of Tariffs we will be able to start paying down large amounts of the $21 Trillion in debt that has been accumulated\, much by the Obama Administration\, while at the same time reducing taxes for our people. At minimum\, we will make much better Trade Deals for our country!",,,,
Sun Aug 05 11:59:29 +0000 2018,75150,1.02608E+18,NULL,16604,Twitter for iPhone,"Tariffs are working big time. Every country on earth wants to take wealth out of the U.S.\, always to our detriment. I say\, as they come\,Tax them. If they don’t want to be taxed\, let them make or build the product in the U.S. In either event\, it means jobs and great wealth.....",,,,
Sun Aug 05 11:38:12 +0000 2018,124918,1.02607E+18,NULL,33755,Twitter for iPhone,The Fake News hates me saying that they are the Enemy of the People only because they know it’s TRUE. I am providing a great service by explaining this to the American People. They purposely cause great division &amp; distrust. They can also cause War! They are very dangerous &amp; sick!,,,,
Sun Aug 05 01:43:01 +0000 2018,63195,1.02592E+18,25073877,15195,Twitter for iPhone,"...Danny O’Connor is a total puppet for Nancy Pelosi and Maxine Waters – Danny wants to raise your taxes\, open your borders\, and take away your 2nd Amendment. Vote for Troy on Tuesday!",,,,
Sun Aug 05 01:43:00 +0000 2018,78784,1.02592E+18,NULL,16505,Twitter for iPhone,"A great night in Ohio’s 12th Congressional District with Troy Balderson! Troy loves Ohio\, and he loves the people of Ohio. He will be fighting for you all the way...",,,,
Sun Aug 05 00:28:25 +0000 2018,61483,1.0259E+18,NULL,13891,Twitter for iPhone,Thank you Ohio. I love you! https://t.co/HYSaQOB6GW,,,,
Sat Aug 04 20:54:49 +0000 2018,0,1.02585E+18,NULL,19899,Twitter for iPhone,"RT @realDonaldTrump: Troy Balderson\, running for Congress from Ohio\, is in a big Election fight with a candidate who just got caught lying…",,,,
Sat Aug 04 20:53:39 +0000 2018,87241,1.02585E+18,NULL,18571,Twitter for iPhone,"Iran\, and it’s economy\, is going very bad\, and fast! I will meet\, or not meet\, it doesn’t matter - it is up to them!",,,,
Sat Aug 04 20:28:09 +0000 2018,64584,1.02584E+18,NULL,9075,Twitter for iPhone,Heading to Ohio!,,,,
Sat Aug 04 20:03:39 +0000 2018,69589,1.02583E+18,NULL,16553,Twitter for iPhone,"....China\, which is for the first time doing poorly against us\, is spending a fortune on ads and P.R. trying to convince and scare our politicians to fight me on Tariffs- because they are really hurting their economy. Likewise other countries. We are Winning\, but must be strong!",,,,
Sat Aug 04 19:58:06 +0000 2018,81002,1.02583E+18,NULL,17819,Twitter for iPhone,"....Tariffs will make our country much richer than it is today. Only fools would disagree. We are using them to negotiate fair trade deals and\, if countries are still unwilling to negotiate\, they will pay us vast sums of money in the form of Tariffs. We win either way......",,,,
Sat Aug 04 19:53:22 +0000 2018,61221,1.02583E+18,NULL,13722,Twitter for iPhone,"....Tariffs have had a tremendous positive impact on our Steel Industry. Plants are opening all over the U.S.\, Steelworkers are working again\, and big dollars are flowing into our Treasury. Other countries use Tariffs against\, but when we use them\, foolish people scream!",,,,
Sat Aug 04 19:47:40 +0000 2018,86527,1.02583E+18,NULL,20071,Twitter for iPhone,"Tariffs are working far better than anyone ever anticipated. China market has dropped 27% in last 4months\, and they are talking to us. Our market is stronger than ever\, and will go up dramatically when these horrible Trade Deals are successfully renegotiated. America First.......",,,,
Sat Aug 04 15:18:53 +0000 2018,60706,1.02576E+18,NULL,12303,Twitter for iPhone,HAPPY BIRTHDAY @USCG! https://t.co/cQo41jcoKn,,,,
Sat Aug 04 13:02:36 +0000 2018,76470,1.02573E+18,NULL,19899,Twitter for iPhone,"Troy Balderson\, running for Congress from Ohio\, is in a big Election fight with a candidate who just got caught lying about his relationship with Nancy Pelosi\, who is weak on Crime\, Borders &amp; your 2nd Amendment-and wants to raise your Taxes (by a lot). Vote for Troy on Tuesday!",,,,
Sat Aug 04 12:49:49 +0000 2018,70696,1.02573E+18,NULL,15637,Twitter for iPhone,"Will be going to Ohio tonight to campaign for Troy Balderson for the big Congressional Special Election on Tuesday. Early voting is on. Troy is strong on Crime\, the Border &amp; loves our Military\, Vets &amp; 2nd Amendment. His opponent is a puppet of Nancy Pelosi/high taxes.",,,,
Sat Aug 04 03:37:36 +0000 2018,180381,1.02559E+18,NULL,49313,Twitter for iPhone,"Lebron James was just interviewed by the dumbest man on television\, Don Lemon. He made Lebron look smart\, which isn’t easy to do. I like Mike!",,,,
Sat Aug 04 03:30:30 +0000 2018,0,1.02558E+18,NULL,10184,Twitter for iPhone,RT @seanhannity: https://t.co/RAVcGZwsiS,,,,
Sat Aug 04 03:29:41 +0000 2018,0,1.02558E+18,NULL,6136,Twitter for iPhone,"RT @VinceMcMahon: Grateful for our special #MakeAWish guest at @WWE HQ. Thanks for visiting us\, Tyler … and for making yourself comfortable…",,,,
Sat Aug 04 03:28:06 +0000 2018,57212,1.02558E+18,NULL,18732,Twitter for iPhone,...Dianne is the person leading our Nation on “Collusion” with Russia (only done by Dems). Will she now investigate herself? https://t.co/OG6l04bBwg,,,,
Sat Aug 04 03:24:48 +0000 2018,0,1.02558E+18,NULL,12743,Twitter for iPhone,RT @WhiteHouse: “This is probably the most pro-active administration regarding urban America and the faith-based community in my lifetime.…,,,,
Sat Aug 04 03:17:51 +0000 2018,0,1.02558E+18,NULL,10510,Twitter for iPhone,"RT @DRUDGE_REPORT: NYT editorial board member: 'Kill More Men\,' 'F*ck The Police'... https://t.co/f7Vu1dycyi",,,,
Sat Aug 04 03:15:23 +0000 2018,0,1.02558E+18,NULL,9260,Twitter for iPhone,"RT @WhiteHouse: Under President Trump\, the economy is roaring\, jobs are soaring\, and the American worker is seeing more money in their payc…",,,,
Sat Aug 04 03:10:55 +0000 2018,0,1.02558E+18,NULL,7706,Twitter for iPhone,"RT @DRUDGE_REPORT: Manufacturing +37\,000... https://t.co/XparcYpi3G",,,,
Sat Aug 04 03:09:16 +0000 2018,0,1.02558E+18,NULL,9227,Twitter for iPhone,"RT @DRUDGE_REPORT: RECORD 155\,965\,000 EMPLOYED https://t.co/SPazgBPyz2",,,,
Sat Aug 04 03:08:55 +0000 2018,0,1.02558E+18,NULL,6630,Twitter for iPhone,RT @DRUDGE_REPORT: Hispanic unemployment record low... https://t.co/ky1W0I6pQ2,,,,
Sat Aug 04 03:05:55 +0000 2018,0,1.02558E+18,NULL,14464,Twitter for iPhone,"RT @realDonaldTrump: “Private payrolls boom in July\, increasing by 219\,000 vs 185\,000 estimate: ADP” https://t.co/SeU9kGpima",,,,
Sat Aug 04 03:05:20 +0000 2018,0,1.02558E+18,NULL,6262,Twitter for iPhone,"RT @Scavino45: ✅”US workers see biggest pay\, benefit increase in 10 years” https://t.co/eD9vxbBMBb",,,,
Sat Aug 04 03:05:04 +0000 2018,0,1.02558E+18,NULL,5529,Twitter for iPhone,RT @Scavino45: .@POTUS @realDonaldTrump and @UFC’s @DanaWhite in the Oval Office earlier today at the @WhiteHouse.... https://t.co/JC9jPsn4…,,,,
Sat Aug 04 03:05:00 +0000 2018,0,1.02558E+18,NULL,7328,Twitter for iPhone,RT @Scavino45: “Pro-Trump pastor: Trump is ‘the most pro-black’ president I've ever seen” https://t.co/5GoQOoeCP3,,,,
Sat Aug 04 03:01:46 +0000 2018,60344,1.02558E+18,NULL,13932,Twitter for iPhone,"Congratulations to Gregg Jarrett on his book\, “THE RUSSIA HOAX\, THE ILLICIT SCHEME TO CLEAR HILLARY CLINTON AND FRAME DONALD TRUMP\,” going to #1 on @nytimes and Amazon. It is indeed a HOAX and WITCH HUNT\, illegally started by people who have already been disgraced. Great book!",,,,
Sat Aug 04 01:06:28 +0000 2018,86511,1.02555E+18,NULL,21640,Twitter for iPhone,"Great photo from Ocean City\, Maryland. Thank you. MAKE AMERICA GREAT AGAIN! https://t.co/kILZz31yDJ",,,,
Fri Aug 03 22:59:47 +0000 2018,98844,1.02552E+18,NULL,22625,Twitter for iPhone,"Almost 500\,000 Manufacturing Jobs created since I won the Election. Remember when my opponents were saying that we couldn’t create this type of job anymore. Wrong\, in fact these are among our best and most important jobs!",,,,
Fri Aug 03 22:55:38 +0000 2018,46532,1.02552E+18,NULL,10310,Twitter for iPhone,“The media are good news fire extinguishers!” @greggutfeld @TheFive,,,,
Fri Aug 03 22:43:03 +0000 2018,81570,1.02551E+18,NULL,17608,Twitter for iPhone,"NASA\, which is making a BIG comeback under the Trump Administration\, has just named 9 astronauts for Boeing and Spacex space flights. We have the greatest facilities in the world and we are now letting the private sector pay to use them. Exciting things happening. Space Force!",,,,
Fri Aug 03 22:10:35 +0000 2018,77998,1.0255E+18,NULL,18443,Twitter for iPhone,July is just the ninth month since 1970 that unemployment has fallen below 4%. Our economy has added 3.7 million jobs since I won the Election. 4.1 GDP. More than 4 million people have received a pay raise due to tax reform. $400 Billion brought back from “overseas.” @FoxNews,,,,
Fri Aug 03 22:00:39 +0000 2018,70395,1.0255E+18,NULL,15808,Twitter for iPhone,"Marsha Blackburn had a BIG win last night in the Tennessee primary for U.S. Senate. She is an outstanding person &amp; great supporter of mine. Congratulations Marsha\, we need you very badly in the Senate to vote for our agenda. Your next opponent will vote against all we are doing!",,,,
Fri Aug 03 20:31:52 +0000 2018,60075,1.02548E+18,NULL,15398,Twitter for iPhone,“Pastor praises Trump as 'pro-black' at prison reform event” https://t.co/xFKf1arebx,,,,
Fri Aug 03 18:50:03 +0000 2018,0,1.02545E+18,NULL,15448,Twitter for iPhone,RT @Rasmussen_Poll: Today’s @realDonaldTrump approval ratings among black voters: 29%\n \nThis time last year: 15%\n\nhttps://t.co/mazBCWoIMy @…,,,,
Fri Aug 03 17:39:06 +0000 2018,41383,1.02544E+18,NULL,8647,Twitter for iPhone,Congratulations Marsha! https://t.co/JSMiOWfbxa,,,,
Fri Aug 03 14:21:48 +0000 2018,77708,1.02539E+18,NULL,16043,Twitter for iPhone,Congratulations to Bill Lee of Tennessee on his big primary win for Governor last night.  He ran a great campaign and now will finish off the job in November. Bill has my total and enthusiastic Endorsement!,,,,
Fri Aug 03 00:30:28 +0000 2018,80610,1.02518E+18,NULL,18236,Twitter for iPhone,Thank you Pennsylvania. I love you! https://t.co/qoswnBZb3f,,,,
Thu Aug 02 20:24:33 +0000 2018,145812,1.02512E+18,NULL,34404,Twitter for iPhone,"They asked my daughter Ivanka whether or not the media is the enemy of the people. She correctly said no. It is the FAKE NEWS\, which is a large percentage of the media\, that is the enemy of the people!",,,,
Thu Aug 02 19:08:37 +0000 2018,40419,1.0251E+18,NULL,9501,Twitter for iPhone,"Looking forward to being in the Great State of Ohio on Saturday night where I will be campaigning hard for a truly talented future Congressman\, @Troy_Balderson. See you all then! Tickets: https://t.co/8UOykaI8uf https://t.co/jHdtAy5fgj",,,,
Thu Aug 02 18:57:44 +0000 2018,63019,1.02509E+18,NULL,13769,Twitter for iPhone,When the House and Senate meet on the very important Farm Bill – we love our farmers - hopefully they will be able to leave the WORK REQUIREMENTS FOR FOOD STAMPS PROVISION that the House approved. Senate should go to 51 votes!,,,,
Thu Aug 02 18:55:23 +0000 2018,80304,1.02509E+18,NULL,17076,Twitter for iPhone,"Pennsylvania has to love Trump because unlike all of the others before me\, I am bringing STEEL BACK in a VERY BIG way. Plants opening up in Pennsylvania\, and all over the Country\, and Congressman Lou Barletta\, who is running for the Senate in Pennsylvania\, is really helping!",,,,
Thu Aug 02 18:53:58 +0000 2018,64860,1.02509E+18,NULL,13812,Twitter for iPhone,"Looking forward to being in the Great State of Pennsylvania where we had a tremendous victory in the Election. Will be campaigning hard for an original supporter\, Lou Barletta\, to replace a weak an ineffective Senator\, Bob Casey. Lou is tough and smart\, loves PA and our Country!",,,,
Thu Aug 02 18:45:49 +0000 2018,5746,1.02509E+18,NULL,1508,Twitter for iPhone,Congressman Steve Stivers of Ohio has done a fantastic job as Chairman of the @NRCC. He is a great Congressman who is tough on crime &amp; borders &amp; an inspiration to our Military &amp; Vets. Big on 2nd Amendment. Get out and vote for Steve on Aug 7th. He has my full &amp; total endorsement!,,,,
Thu Aug 02 17:23:50 +0000 2018,92481,1.02507E+18,NULL,21721,Twitter for iPhone,"Working hard\, thank you! https://t.co/pNXbFNcf8z",,,,
Thu Aug 02 11:04:04 +0000 2018,97812,1.02497E+18,NULL,21829,Twitter for iPhone,"Wow\, @foxandfriends is blowing away the competition in the morning ratings. Morning Joe is a dead show with very few people watching and sadly\, Fake News CNN is also doing poorly. Too much hate and inaccurately reported stories - too predictable!",,,,
Thu Aug 02 10:38:15 +0000 2018,102889,1.02497E+18,NULL,25836,Twitter for iPhone,"Charles Koch of Koch Brothers\, who claims to be giving away millions of dollars to politicians even though I know very few who have seen this (?)\, now makes the ridiculous statement that what President Trump is doing is unfair to “foreign workers.” He is correct\, AMERICA FIRST!",,,,
Thu Aug 02 04:47:25 +0000 2018,130250,1.02488E+18,NULL,26299,Twitter for iPhone,"Thank you to Chairman Kim Jong Un for keeping your word &amp; starting the process of sending home the remains of our great and beloved missing fallen! I am not at all surprised that you took this kind action. Also\, thank you for your nice letter - l look forward to seeing you soon!",,,,
Thu Aug 02 04:38:15 +0000 2018,70597,1.02488E+18,NULL,17180,Twitter for iPhone,"Congratulations to  @GreggJarrett on The TREMENDOUS success of his just out book\, “The Russia Hoax\, The Illicit Scheme To Clear Hillary Clinton &amp; Frame Donald Trump.” Already number one on Amazon. Hard work from a brilliant guy. It’s the Real Story of the Rigged Witch Hunt!",,,,
Thu Aug 02 03:40:24 +0000 2018,0,1.02486E+18,NULL,18924,Twitter for iPhone,RT @realDonaldTrump: “Worker pay rate hits highest level since 2008” https://t.co/pMDxHQqcg9,,,,
Thu Aug 02 03:32:14 +0000 2018,86814,1.02486E+18,NULL,17350,Twitter for iPhone,Incredibly beautiful ceremony as U.S. Korean War remains are returned to American soil. Thank you to Honolulu and all of our great Military participants on a job well done. A special thanks to Vice President Mike Pence on delivering a truly magnificent tribute!,,,,
Wed Aug 01 21:16:11 +0000 2018,59365,1.02477E+18,NULL,14477,Twitter for iPhone,"“Private payrolls boom in July\, increasing by 219\,000 vs 185\,000 estimate: ADP” https://t.co/SeU9kGpima",,,,
Wed Aug 01 21:04:18 +0000 2018,45573,1.02476E+18,NULL,11284,Twitter for iPhone,"Join me tomorrow night at 7pmE in Wilkes-Barre Township\, Pennsylvania for a MAKE AMERICA GREAT AGAIN RALLY! Tickets: https://t.co/dR6EzS3Q8L https://t.co/c52kIxvdF7",,,,
Wed Aug 01 19:22:01 +0000 2018,50277,1.02474E+18,NULL,11876,Twitter for iPhone,#PledgeToAmericasWorkers https://t.co/qIJQfQ3bos,,,,
Wed Aug 01 18:55:56 +0000 2018,65957,1.02473E+18,NULL,15638,Twitter for iPhone,It was my great honor to be joined by leading pastors and faith leaders from across our Nation today at the @WhiteHouse! https://t.co/6sS1zGA1p7,,,,
Wed Aug 01 15:56:31 +0000 2018,79041,1.02469E+18,NULL,21566,Twitter for iPhone,"“We already have a smoking gun about a campaign getting dirt on their opponent\, it was Hillary Clinton. How is it OK for Hillary Clinton to proactively seek dirt from the Russians but the Trump campaign met at the Russians request and that is bad?” Marc Thiessen\, Washington Post",,,,
Wed Aug 01 15:35:47 +0000 2018,71912,1.02468E+18,NULL,18537,Twitter for iPhone,"Looking back on history\, who was treated worse\, Alfonse Capone\, legendary mob boss\, killer and “Public Enemy Number One\,” or Paul Manafort\, political operative &amp; Reagan/Dole darling\, now serving solitary confinement - although convicted of nothing? Where is the Russian Collusion?",,,,
Wed Aug 01 15:23:13 +0000 2018,15030,1.02468E+18,NULL,4448,Twitter for iPhone,"“We already have a smocking gun about a campaign getting dirt on their opponent\, it was Hillary Clinton. How is it OK for Hillary Clinton to proactively seek dirt from the Russians but the Trump campaign met at the Russians request and that is bad?” Marc Thiessen\, Washington Post",,,,
Wed Aug 01 14:01:53 +0000 2018,84988,1.02466E+18,NULL,22187,Twitter for iPhone,"Russian Collusion with the Trump Campaign\, one of the most successful in history\, is a TOTAL HOAX. The Democrats paid for the phony and discredited Dossier which was\, along with Comey\, McCabe\, Strzok and his lover\, the lovely Lisa Page\, used to begin the Witch Hunt. Disgraceful!",,,,
Wed Aug 01 13:34:03 +0000 2018,89238,1.02465E+18,NULL,23314,Twitter for iPhone,"Paul Manafort worked for Ronald Reagan\, Bob Dole and many other highly prominent and respected political leaders. He worked for me for a very short time. Why didn’t government tell me that he was under investigation. These old charges have nothing to do with Collusion - a Hoax!",,,,
Wed Aug 01 13:24:03 +0000 2018,96678,1.02465E+18,NULL,25318,Twitter for iPhone,"..This is a terrible situation and Attorney General Jeff Sessions should stop this Rigged Witch Hunt right now\, before it continues to stain our country any further. Bob Mueller is totally conflicted\, and his 17 Angry Democrats that are doing his dirty work are a disgrace to USA!",,,,
Wed Aug 01 13:15:24 +0000 2018,64593,1.02464E+18,NULL,16547,Twitter for iPhone,.....remain in the FBI while he himself was being investigated. This is a real issue. It won’t go into a Mueller Report because Mueller is going to protect these guys. Mueller has an interest in creating the illusion of objectivity around his investigation.” ALAN DERSHOWITZ....,,,,
Wed Aug 01 13:03:08 +0000 2018,82452,1.02464E+18,NULL,20828,Twitter for iPhone,"“FBI Agent Peter Strzok (on the Mueller team) should have recused himself on day one. He was out to STOP THE ELECTION OF DONALD TRUMP. He needed an insurance policy. Those are illegal\, improper goals\, trying to influence the Election. He should never\, ever been allowed to........",,,,
Wed Aug 01 01:37:04 +0000 2018,0,1.02447E+18,NULL,16906,Twitter for iPhone,RT @EricTrump: #Truth @Acosta https://t.co/aCfFoeqL1f,,,,
Wed Aug 01 00:24:25 +0000 2018,75106,1.02445E+18,NULL,17690,Twitter for iPhone,Thank you Florida. I love you!\nhttps://t.co/M5T81DZVUU,,,,
Tue Jul 31 22:50:10 +0000 2018,0,1.02443E+18,NULL,7589,Twitter for iPhone,RT @WhiteHouse: President Trump Delivers Remarks on Workforce Development https://t.co/nE2kMxkHyw,,,,
Tue Jul 31 20:49:25 +0000 2018,50791,1.0244E+18,NULL,8441,Twitter for iPhone,"On my way to Tampa\, Florida. Look forward to seeing everyone soon! https://t.co/BSB6IjBK7r",,,,
Tue Jul 31 20:39:22 +0000 2018,74178,1.02439E+18,NULL,18921,Twitter for iPhone,“Worker pay rate hits highest level since 2008” https://t.co/pMDxHQqcg9,,,,
Tue Jul 31 17:33:48 +0000 2018,74147,1.02435E+18,25073877,17024,Twitter for iPhone,"...Border Security is National Security\, and National Security is the long-term viability of our Country. A Government Shutdown is a very small price to pay for a safe and Prosperous America!",,,,
Tue Jul 31 17:33:47 +0000 2018,107985,1.02435E+18,NULL,26354,Twitter for iPhone,"I don’t care what the political ramifications are\, our immigration laws and border security have been a complete and total disaster for decades\, and there is no way that the Democrats will allow it to be fixed without a Government Shutdown...",,,,
Tue Jul 31 17:13:32 +0000 2018,46723,1.02434E+18,NULL,11264,Twitter for iPhone,".@SenJohnBarrasso has a Primary on August 21st. He doesn’t need any help because he is absolutely outstanding in every way\, but I hope the great people of Wyoming will go out and show their support anyway. John is absolutely top of the line &amp; has my Complete &amp; Total Endorsement!",,,,
Tue Jul 31 17:09:50 +0000 2018,56547,1.02434E+18,NULL,13301,Twitter for iPhone,"Congressman David Kustoff has been a champion for the Trump Agenda - I greatly appreciate his support. David is strong on crime and borders\, loves our Military\, Vets and Second Amendment. Get out and vote for David on Thursday\, August 2nd. He has my Full and Total Endorsement!",,,,
Tue Jul 31 13:34:47 +0000 2018,102238,1.02429E+18,NULL,24610,Twitter for iPhone,"The Fake News Media is going CRAZY! They are totally unhinged and in many ways\, after witnessing first hand the damage they do to so many innocent and decent people\, I enjoy watching. In 7 years\, when I am no longer in office\, their ratings will dry up and they will be gone!",,,,
Tue Jul 31 12:21:48 +0000 2018,56186,1.02427E+18,NULL,13410,Twitter for iPhone,"Will be in Tampa tonight. A big year for @RepDeSantis\, who will be a great governor for Florida. Strong on Crime\, Borders and our 2nd Amendment. Big help on Tax &amp; Regulation Cuts. Loves our Military &amp; our Vets. Has my Full &amp; Total Endorsement!",,,,
Tue Jul 31 12:03:30 +0000 2018,52390,1.02426E+18,NULL,10376,Twitter for iPhone,"I am looking into 3-D Plastic Guns being sold to the public. Already spoke to NRA\, doesn’t seem to make much sense!",,,,
Tue Jul 31 11:58:58 +0000 2018,86389,1.02426E+18,NULL,19514,Twitter for iPhone,"Collusion is not a crime\, but that doesn’t matter because there was No Collusion (except by Crooked Hillary and the Democrats)!",,,,
Tue Jul 31 11:00:41 +0000 2018,91904,1.02425E+18,NULL,24687,Twitter for iPhone,"One of the reasons we need Great Border Security is that Mexico’s murder rate in 2017 increased by 27% to 31\,174 people killed\, a record! The Democrats want Open Borders. I want Maximum Border Security and respect for ICE and our great Law Enforcement Professionals! @FoxNews",,,,
Tue Jul 31 10:50:28 +0000 2018,74560,1.02425E+18,NULL,15348,Twitter for iPhone,Rush Limbaugh is a great guy who truly gets it!,,,,
Tue Jul 31 10:30:23 +0000 2018,0,1.02424E+18,NULL,6160,Twitter for iPhone,"RT @dougmillsnyt: .@realDonaldTrump walks with Giuseppe Conte\, Prime Minister of the Italy following a joint news conference in the East Ro…",,,,
Tue Jul 31 10:29:59 +0000 2018,0,1.02424E+18,NULL,6892,Twitter for iPhone,RT @dougmillsnyt: .@realDonaldTrump pumps his fist after his new Secretary of Veterans Affairs  Robert Wilkie is sworn-in by @VP Mike Pence…,,,,
Tue Jul 31 10:23:41 +0000 2018,74917,1.02424E+18,NULL,16864,Twitter for iPhone,"....them richer. Their network is highly overrated\, I have beaten them at every turn. They want to protect their companies outside the U.S. from being taxed\, I’m for America First &amp; the American Worker - a puppet for no one. Two nice guys with bad ideas. Make America Great Again!",,,,
Tue Jul 31 10:14:18 +0000 2018,88242,1.02424E+18,NULL,22095,Twitter for iPhone,"The globalist Koch Brothers\, who have become a total joke in real Republican circles\, are against Strong Borders and Powerful Trade. I never sought their support because I don’t need their money or bad ideas. They love my Tax &amp; Regulation Cuts\, Judicial picks &amp; more. I made.....",,,,
Tue Jul 31 02:01:02 +0000 2018,110155,1.02411E+18,NULL,36406,Media Studio,MAKING AMERICA GREAT AGAIN! https://t.co/OnMGXvldVT,,,,
Tue Jul 31 00:56:16 +0000 2018,88708,1.0241E+18,NULL,21905,Twitter for iPhone,"A highly respected Federal judge today stated that the “Trump Administration gets great credit” for reuniting illegal families. Thank you\, and please look at the previous administrations record - not good!",,,,
Mon Jul 30 22:44:12 +0000 2018,42660,1.02406E+18,NULL,8963,Twitter for iPhone,"Congratulations to our new @DeptVetAffairs Secretary\, Robert Wilkie! https://t.co/6erqWJzuiK",,,,
Mon Jul 30 22:36:02 +0000 2018,79854,1.02406E+18,NULL,16807,Twitter for iPhone,"Thank you to @RandPaul for your YES on a future great Justice of the Supreme Court\, Brett Kavanaugh. Your vote means a lot to me\, and to everyone who loves our Country!",,,,
Mon Jul 30 22:34:22 +0000 2018,62004,1.02406E+18,25073877,13975,Twitter for iPhone,"...that Open Borders\, large scale Crime\, and abolishing ICE is good for them\, we must get smart and finally do what must be done for the Safety and Security of our Country!",,,,
