created_at,favorite_count,id_str,in_reply_to_user_id_str,retweet_count,source,text,,,,
Mon Dec 31 23:53:06 +0000 2018,136012,1.07989E+18,NULL,33548,Twitter for iPhone,HAPPY NEW YEAR! https://t.co/bHoPDPQ7G6,,,,
Mon Dec 31 20:02:52 +0000 2018,65069,1.07983E+18,25073877,17456,Twitter for iPhone,"....Senator Schumer\, more than a year longer than any other Administration in history. These are people who have been approved by committees and all others\, yet Schumer continues to hold them back from serving their Country! Very Unfair!",,,,
Mon Dec 31 20:02:52 +0000 2018,76721,1.07983E+18,NULL,21030,Twitter for iPhone,Heads of countries are calling wanting to know why Senator Schumer is not approving their otherwise approved Ambassadors!? Likewise in Government lawyers and others are being delayed at a record pace! 360 great and hardworking people are waiting for approval from....,,,,
Mon Dec 31 15:39:15 +0000 2018,127485,1.07976E+18,NULL,29610,Twitter for iPhone,"It’s incredible how Democrats can all use their ridiculous sound bite and say that a Wall doesn’t work. It does\, and properly built\, almost 100%! They say it’s old technology - but so is the wheel. They now say it is immoral- but it is far more immoral for people to be dying!",,,,
Mon Dec 31 15:37:14 +0000 2018,132439,1.07976E+18,NULL,30957,Twitter for iPhone,"I’m in the Oval Office. Democrats\, come back from vacation now and give us the votes necessary for Border Security\, including the Wall. You voted yes in 2006 and 2013. One more yes\, but with me in office\, I’ll get it built\, and Fast!",,,,
Mon Dec 31 15:33:15 +0000 2018,4217,1.07976E+18,NULL,1123,Twitter for iPhone,"I’m in the Oval Office. Democrats\, come back from vacation now and give us the votes necessary for Border Security\, including the Wall. You voted yes in 2006 and 3013. One more yes\, but with me in office\, I’ll get it built\, and Fast!",,,,
Mon Dec 31 14:38:52 +0000 2018,112735,1.07975E+18,NULL,25463,Twitter for iPhone,"I am the only person in America who could say that\, “I’m bringing our great troops back home\, with victory\,” and get BAD press. It is Fake News and Pundits who have FAILED for years that are doing the complaining. If I stayed in Endless Wars forever\, they would still be unhappy!",,,,
Mon Dec 31 13:29:32 +0000 2018,91523,1.07973E+18,NULL,22079,Twitter for iPhone,"I campaigned on Border Security\, which you cannot have without a strong and powerful Wall. Our Southern Border has long been an “Open Wound\,” where drugs\, criminals (including human traffickers) and illegals would pour into our Country. Dems should get back here an fix now!",,,,
Mon Dec 31 13:19:13 +0000 2018,72758,1.07973E+18,NULL,15152,Twitter for iPhone,".....Except the results are FAR BETTER than I ever said they were going to be! I campaigned against the NEVER ENDING WARS\, remember!",,,,
Mon Dec 31 13:12:40 +0000 2018,101470,1.07973E+18,NULL,22119,Twitter for iPhone,"...I campaigned on getting out of Syria and other places. Now when I start getting out the Fake News Media\, or some failed Generals who were unable to do the job before I arrived\, like to complain about me &amp; my tactics\, which are working. Just doing what I said I was going to do!",,,,
Mon Dec 31 13:03:05 +0000 2018,79534,1.07972E+18,NULL,17467,Twitter for iPhone,"If anybody but Donald Trump did what I did in Syria\, which was an ISIS loaded mess when I became President\, they would be a national hero. ISIS is mostly gone\, we’re slowly sending our troops back home to be with their families\, while at the same time fighting ISIS remnants......",,,,
Mon Dec 31 12:51:22 +0000 2018,97178,1.07972E+18,NULL,20873,Twitter for iPhone,"An all concrete Wall was NEVER ABANDONED\, as has been reported by the media. Some areas will be all concrete but the experts at Border Patrol prefer a Wall that is see through (thereby making it possible to see what is happening on both sides). Makes sense to me!",,,,
Sun Dec 30 21:59:44 +0000 2018,233722,1.0795E+18,NULL,61837,Twitter for iPhone,"President and Mrs. Obama built/has a ten foot Wall around their D.C. mansion/compound. I agree\, totally necessary for their safety and security. The U.S. needs the same thing\, slightly larger version!",,,,
Sun Dec 30 16:56:09 +0000 2018,131013,1.07942E+18,NULL,32084,Twitter for iPhone,Great work by my Administration over the holidays to save Coast Guard pay during this #SchumerShutdown. No thanks to the Democrats who left town and are not concerned about the safety and security of Americans!,,,,
Sun Dec 30 15:28:35 +0000 2018,123780,1.0794E+18,NULL,25782,Twitter for iPhone,Veterans on President Trump’s handling of Border Security - 62% Approval Rating. On being a strong leader - 59%.  AP Poll. Thank you!,,,,
Sun Dec 30 03:15:36 +0000 2018,150249,1.07921E+18,NULL,44918,Twitter for iPhone,"“It turns out to be true now\, that the Department of Justice and the FBI\, under President Obama\, rigged the investigation for Hillary and really turned the screws on Trump\, and now it looks like in a corrupt &amp; illegal way. The facts are out now. Whole Hoax exposed. @JesseBWatters",,,,
Sun Dec 30 03:01:28 +0000 2018,118323,1.07921E+18,NULL,30800,Twitter for iPhone,"“Absolutely nothing” (on Russian Collusion). Kimberley Strassel\, The Wall Street Journal. The Russian Collusion fabrication is the greatest Hoax in the history of American politics. The only Russian Collusion was with Hillary and the Democrats!",,,,
Sat Dec 29 21:06:08 +0000 2018,109368,1.07912E+18,NULL,25809,Twitter for iPhone,"2018 is being called “THE YEAR OF THE WORKER” by Steve Moore\, co-author of “Trumponomics.” It was indeed a great year for the American Worker with the “best job market in 50 years\, and the lowest unemployment rate ever for blacks and Hispanics and all workers. Big wage gains.”",,,,
Sat Dec 29 19:25:47 +0000 2018,144416,1.0791E+18,NULL,34547,Twitter for iPhone,"For those that naively ask why didn’t the Republicans get approval to build the Wall over the last year\, it is because IN THE SENATE WE NEED 10 DEMOCRAT VOTES\, and they will gives us “NONE” for Border Security! Now we have to do it the hard way\, with a Shutdown. Too bad! @FoxNews",,,,
Sat Dec 29 18:36:17 +0000 2018,129861,1.07908E+18,NULL,30224,Twitter for iPhone,"...children in question were very sick before they were given over to Border Patrol. The father of the young girl said it was not their fault\, he hadn’t given her water in days. Border Patrol needs the Wall and it will all end. They are working so hard &amp; getting so little credit!",,,,
Sat Dec 29 18:30:16 +0000 2018,120754,1.07908E+18,NULL,29381,Twitter for iPhone,"Any deaths of children or others at the Border are strictly the fault of the Democrats and their pathetic immigration policies that allow people to make the long trek thinking they can enter our country illegally. They can’t. If we had a Wall\, they wouldn’t even try! The two.....",,,,
Sat Dec 29 16:03:02 +0000 2018,142185,1.07905E+18,NULL,27736,Twitter for iPhone,"Just had a long and very good call with President Xi of China. Deal is moving along very well. If made\, it will be very comprehensive\, covering all subjects\, areas and points of dispute. Big progress being made!",,,,
Sat Dec 29 15:52:24 +0000 2018,127645,1.07904E+18,NULL,30025,Twitter for iPhone,"I am in the White House waiting for the Democrats to come on over and make a deal on Border Security. From what I hear\, they are spending so much time on Presidential Harassment that they have little time left for things like stopping crime and our military!",,,,
Sat Dec 29 15:42:50 +0000 2018,112124,1.07904E+18,NULL,32062,Twitter for iPhone,"The Mueller Angry Democrats recently deleted approximately 19\,000 Text messages between FBI Agent Lisa Page and her lover\, Agent Peter S. These Texts were asked for and INVALUABLE to the truth of the Witch Hunt Hoax. This is a total Obstruction of Justice. All Texts Demanded!",,,,
Fri Dec 28 14:51:07 +0000 2018,113934,1.07866E+18,NULL,21412,Twitter for iPhone,Thank you to Sean Parnell for the nice comments on @foxandfriends about the troops wonderful reaction to Melania and I in Iraq and Germany. Great things are happening!,,,,
Fri Dec 28 13:06:13 +0000 2018,167219,1.07864E+18,NULL,39555,Twitter for iPhone,".....Honduras\, Guatemala and El Salvador are doing nothing for the United States but taking our money. Word is that a new Caravan is forming in Honduras and they are doing nothing about it. We will be cutting off all aid to these 3 countries - taking advantage of U.S. for years!",,,,
Fri Dec 28 12:49:26 +0000 2018,108226,1.07863E+18,NULL,25317,Twitter for iPhone,".....close the Southern Border. Bring our car industry back into the United States where it belongs. Go back to pre-NAFTA\, before so many of our companies and jobs were so foolishly sent to Mexico. Either we build (finish) the Wall or we close the Border......",,,,
Fri Dec 28 12:42:12 +0000 2018,101171,1.07863E+18,NULL,23743,Twitter for iPhone,"....The United States looses soooo much money on Trade with Mexico under NAFTA\, over 75 Billion Dollars a year (not including Drug Money which would be many times that amount)\, that I would consider closing the Southern Border a “profit making operation.” We build a Wall or.....",,,,
Fri Dec 28 12:16:40 +0000 2018,156509,1.07863E+18,NULL,36288,Twitter for iPhone,We will be forced to close the Southern Border entirely if the Obstructionist Democrats do not give us the money to finish the Wall &amp; also change the ridiculous immigration laws that our Country is saddled with. Hard to believe there was a Congress &amp; President who would approve!,,,,
Thu Dec 27 23:23:36 +0000 2018,181505,1.07843E+18,NULL,43776,Twitter for iPhone,"CNN &amp; others within the Fake News Universe were going wild about my signing MAGA hats for our military in Iraq and Germany. If these brave young people ask me to sign their hat\, I will sign. Can you imagine my saying NO? We brought or gave NO hats as the Fake News first reported!",,,,
Thu Dec 27 22:10:07 +0000 2018,127963,1.07841E+18,NULL,31411,Twitter for iPhone,"This isn’t about the Wall\, everybody knows that a Wall will work perfectly (In Israel the Wall works 99.9%). This is only about the Dems not letting Donald Trump &amp; the Republicans have a win. They may have the 10 Senate votes\, but we have the issue\, Border Security. 2020!",,,,
Thu Dec 27 21:26:10 +0000 2018,85219,1.0784E+18,NULL,19652,Twitter for iPhone,"Brad Blakeman: “The American people understand that we have been played by foreign actors who would rather have us fight their battles for them. The President says look\, this is your neighborhood\, you’ve got to stand up to protect yourselves. Don’t always look to America.”",,,,
Thu Dec 27 21:13:15 +0000 2018,9448,1.0784E+18,NULL,2510,Twitter for iPhone,"Brad Blakeman: “The American people understand that we have been played by foreign actors who would rather have us fight their battles for them. The Pesident says look\, this is your neighborhood\, you’ve got to stand up to protect yourselves. Don’t always look to America.”",,,,
Thu Dec 27 21:04:24 +0000 2018,180032,1.0784E+18,NULL,45971,Twitter for iPhone,I totally agree! https://t.co/KO8E3bfWfn,,,,
Thu Dec 27 21:04:06 +0000 2018,146339,1.0784E+18,NULL,36526,Twitter for iPhone,There is right now a full scale manhunt going on in California for an illegal immigrant accused of shooting and killing a police officer during a traffic stop. Time to get tough on Border Security. Build the Wall!,,,,
Thu Dec 27 20:39:59 +0000 2018,105345,1.07839E+18,NULL,24285,Twitter for iPhone,"“Border Patrol Agents want the Wall.” Democrat’s say they don’t want the Wall (even though they know it is really needed)\, and they don’t want ICE. They don’t have much to campaign on\, do they? An Open Southern Border and the large scale crime that comes with such stupidity!",,,,
Thu Dec 27 19:44:49 +0000 2018,82021,1.07838E+18,NULL,21143,Twitter for iPhone,"The reason the DACA for Wall deal didn’t get done was that a ridiculous court decision from the 9th Circuit allowed DACA to remain\, thereby setting up a Supreme Court case. After ruling\, Dems dropped deal - and that’s where we are today\, Democrat obstruction of the needed Wall.",,,,
Thu Dec 27 19:41:45 +0000 2018,84827,1.07838E+18,NULL,20173,Twitter for iPhone,"The Democrats OBSTRUCTION of the desperately needed Wall\, where they almost all recently agreed it should be built\, is exceeded only by their OBSTRUCTION of 350 great people wanting &amp; expecting to come into Government after being delayed for more than two years\, a U.S. record!",,,,
Thu Dec 27 19:35:46 +0000 2018,8218,1.07837E+18,NULL,2339,Twitter for iPhone,"The reason the DACA for Wall deal didn’t get done was that a ridiculous court decision from the 9th Circuit allowed DACA to remain\, thereby setting up a Supteme Court case. After ruling\, Dems dropped deal - and that’s where we are today\, Democrat obstruction of the needed Wall.",,,,
Thu Dec 27 12:06:25 +0000 2018,131898,1.07826E+18,NULL,30543,Twitter for iPhone,"Have the Democrats finally realized that we desperately need Border Security and a Wall on the Southern Border. Need to stop Drugs\, Human Trafficking\,Gang Members &amp; Criminals from coming into our Country. Do the Dems realize that most of the people not getting paid are Democrats?",,,,
Thu Dec 27 11:59:04 +0000 2018,169681,1.07826E+18,NULL,29624,Twitter for iPhone,"Just returned from visiting our troops in Iraq and Germany. One thing is certain\, we have incredible people representing our Country - people that know how to win!",,,,
Wed Dec 26 20:35:25 +0000 2018,222929,1.07803E+18,NULL,50449,Twitter for iPhone,.@FLOTUS Melania and I were honored to visit our incredible troops at Al Asad Air Base in Iraq. GOD BLESS THE U.S.A.! https://t.co/rDlhITDvm1,,,,
Tue Dec 25 23:18:44 +0000 2018,249872,1.07771E+18,NULL,46597,Twitter for iPhone,"I hope everyone\, even the Fake News Media\, is having a great Christmas! Our Country is doing very well. We are securing our Borders\, making great new Trade Deals\, and bringing our Troops Back Home. We are finally putting America First. MERRY CHRISTMAS!  #MAGA",,,,
Tue Dec 25 12:59:08 +0000 2018,508372,1.07755E+18,NULL,89255,Twitter for iPhone,Merry Christmas!,,,,
Tue Dec 25 02:28:40 +0000 2018,0,1.07739E+18,NULL,24696,Twitter for iPhone,RT @FLOTUS: Helping children across the country track #Santa is becoming one of my favorite traditions!  @Potus and I enjoyed working with…,,,,
Mon Dec 24 22:24:13 +0000 2018,182064,1.07733E+18,NULL,41155,Twitter for iPhone,"I am in the Oval Office &amp; just gave out a 115 mile long contract for another large section of the Wall in Texas. We are already building and renovating many miles of Wall\, some complete. Democrats must end Shutdown and finish funding. Billions of Dollars\, &amp; lives\, will be saved!",,,,
Mon Dec 24 21:14:12 +0000 2018,88639,1.07731E+18,NULL,17567,Twitter for iPhone,Christmas Eve briefing with my team working on North Korea – Progress being made. Looking forward to my next summit with Chairman Kim! https://t.co/zPTtDbrP0o,,,,
Mon Dec 24 17:32:44 +0000 2018,181975,1.07726E+18,NULL,37861,Twitter for iPhone,I am all alone (poor me) in the White House waiting for the Democrats to come back and make a deal on desperately needed Border Security. At some point the Democrats not wanting to make a deal will cost our Country more money than the Border Wall we are all talking about. Crazy!,,,,
Mon Dec 24 17:23:22 +0000 2018,156918,1.07725E+18,NULL,38834,Twitter for iPhone,"Saudi Arabia has now agreed to spend the necessary money needed to help rebuild Syria\, instead of the United States. See? Isn’t it nice when immensely wealthy countries help rebuild their neighbors rather than a Great Country\, the U.S.\, that is 5000 miles away. Thanks to Saudi A!",,,,
Mon Dec 24 17:10:22 +0000 2018,101346,1.07725E+18,NULL,25414,Twitter for iPhone,"The Wall is different than the 25 Billion Dollars in Border Security. The complete Wall will be built with the Shutdown money plus funds already in hand. The reporting has been inaccurate on the point. The problem is\, without the Wall\, much of the rest of Dollars are wasted!",,,,
Mon Dec 24 16:55:32 +0000 2018,88352,1.07725E+18,NULL,19239,Twitter for iPhone,"I never “lashed out” at the Acting Attorney General of the U.S.\, a man for whom I have great respect. This is a made up story\, one of many\, by the Fake News Media!",,,,
Mon Dec 24 15:55:22 +0000 2018,125042,1.07723E+18,NULL,30509,Twitter for iPhone,"The only problem our economy has is the Fed. They don’t have a feel for the Market\, they don’t understand necessary Trade Wars or Strong Dollars or even Democrat Shutdowns over Borders. The Fed is like a powerful golfer who can’t score because he has no touch - he can’t putt!",,,,
Mon Dec 24 15:33:41 +0000 2018,156730,1.07723E+18,NULL,28409,Twitter for iPhone,AMERICA IS RESPECTED AGAIN!,,,,
Mon Dec 24 15:23:22 +0000 2018,99089,1.07722E+18,NULL,28640,Twitter for iPhone,"For all of the sympathizers out there of Brett McGurk remember\, he was the Obama appointee who was responsible for loading up airplanes with 1.8 Billion Dollars in CASH &amp;  sending it to Iran as part of the horrific Iran Nuclear Deal (now terminated) approved by Little Bob Corker.",,,,
Mon Dec 24 14:59:23 +0000 2018,107536,1.07722E+18,NULL,25119,Twitter for iPhone,"....We are substantially subsidizing the Militaries of many VERY rich countries all over the world\, while at the same time these countries take total advantage of the U.S.\, and our TAXPAYERS\, on Trade. General Mattis did not see this as a problem. I DO\, and it is being fixed!",,,,
Mon Dec 24 14:41:02 +0000 2018,98818,1.07721E+18,NULL,22190,Twitter for iPhone,"To those few Senators who think I don’t like or appreciate being allied with other countries\, they are wrong\, I DO. What I don’t like\, however\, is when many of these same countries take advantage of their friendship with the United States\, both in Military Protection and Trade...",,,,
Mon Dec 24 14:31:50 +0000 2018,108959,1.07721E+18,NULL,25312,Twitter for iPhone,"Virtually every Democrat we are dealing with today strongly supported a Border Wall or Fence. It was only when I made it an important part of my campaign\, because people and drugs were pouring into our Country unchecked\, that they turned against it. Desperately needed!",,,,
Mon Dec 24 04:54:00 +0000 2018,97095,1.07706E+18,NULL,21687,Twitter for iPhone,"President @RT_Erdogan of Turkey has very strongly informed me that he will eradicate whatever is left of ISIS in Syria....and he is a man who can do it plus\, Turkey is right “next door.” Our troops are coming home!",,,,
Mon Dec 24 04:26:22 +0000 2018,78731,1.07706E+18,NULL,16102,Twitter for iPhone,"“The President has been remarkable. I do not doubt that he will thrive in this new environment\, and he will be a constant reminder of what populism is.” Thank you to Tammy Bruce and Steve Hilton. Presidential Harassment has been with me from the beginning!",,,,
Mon Dec 24 04:05:26 +0000 2018,100793,1.07705E+18,NULL,24084,Twitter for iPhone,"The most important way to stop gangs\, drugs\, human trafficking and massive crime is at our Southern Border. We need Border Security\, and as EVERYONE knows\, you can’t have Border Security without a Wall. The Drones &amp; Technology are just bells and whistles. Safety for America!",,,,
Mon Dec 24 03:47:21 +0000 2018,130343,1.07705E+18,NULL,26483,Twitter for iPhone,"Mitch McConnell just told a group of people\, and me\, that he has been in the U.S. Senate for 32 years and the last two have been by far the best &amp; most productive of his career. Tax &amp; Regulation Cuts\, VA Choice\, Farm Bill\, Criminal Justice Reform\, Judgeships &amp; much more. Great!",,,,
Mon Dec 24 03:32:49 +0000 2018,89834,1.07704E+18,NULL,22085,Twitter for iPhone,"“It should not be the job of America to replace regimes around the world. This is what President Trump recognized in Iraq\, that it was the biggest foreign policy disaster of the last several decades\, and he’s right...The generals still don’t get the mistake.”  @RandPaul",,,,
Mon Dec 24 00:42:22 +0000 2018,0,1.077E+18,NULL,1326,Twitter for iPhone,RT @RSScott_BP252: USBP Agents will continue to diligently do their sworn duites through the holidays and the furlough -JUST LIKE EVERY OTH…,,,,
Sun Dec 23 21:18:49 +0000 2018,109499,1.07695E+18,NULL,25269,Twitter for iPhone,"Thanks @RandPaul  “I am very proud of the President. This is exactly what he promised\, and I think the people agree with him. We’ve been at war too long and in too many places...spent several trillion dollars on these wars everywhere. He’s different...that’s why he got elected.”",,,,
Sun Dec 23 20:20:22 +0000 2018,97700,1.07694E+18,NULL,21647,Twitter for iPhone,".....Bob Corker was responsible for giving us the horrible Iran Nuclear Deal\, which I ended\, yet he badmouths me for wanting to bring our young people safely back home. Bob wanted to run and asked for my endorsement. I said NO and the game was over. #MAGA I LOVE TENNESSEE!",,,,
Sun Dec 23 19:56:37 +0000 2018,78531,1.07693E+18,NULL,16542,Twitter for iPhone,"Senator Bob Corker just stated that\, “I’m so priveledged to serve in the Senate for twelve years\, and that’s what I told the people of our state that’s what I’d do\, serve for two terms.” But that is Not True - wanted to run but poll numbers TANKED when I wouldn’t endorse him.....",,,,
Sun Dec 23 19:45:22 +0000 2018,94526,1.07693E+18,NULL,22964,Twitter for iPhone,"We signed two pieces of major legislation this week\, Criminal Justice Reform and the Farm Bill. These are two Big Deals\, but all the Fake News Media wants to talk about is “the mistake” of bringing our young people back home from the Never Ending Wars. It all began 19 years ago!",,,,
Sun Dec 23 17:13:27 +0000 2018,79681,1.07689E+18,NULL,15980,Twitter for iPhone,Unthinkable devastation from the tsunami disaster in Indonesia. More than two hundred dead and nearly a thousand injured or unaccounted for. We are praying for recovery and healing. America is with you!,,,,
Sun Dec 23 16:59:22 +0000 2018,80994,1.07688E+18,NULL,17811,Twitter for iPhone,"I just had a long and productive call with President @RT_Erdogan of Turkey. We discussed ISIS\, our mutual involvement in Syria\, &amp; the slow &amp; highly coordinated pullout of U.S. troops from the area. After many years they are coming home. We also discussed heavily expanded Trade.",,,,
Sun Dec 23 16:46:47 +0000 2018,87099,1.07688E+18,NULL,18488,Twitter for iPhone,"I am pleased to announce that our very talented Deputy Secretary of Defense\, Patrick Shanahan\, will assume the title of Acting Secretary of Defense starting January 1\, 2019. Patrick has a long list of accomplishments while serving as Deputy\, &amp; previously Boeing. He will be great!",,,,
Sun Dec 23 14:17:54 +0000 2018,143519,1.07684E+18,NULL,32373,Twitter for iPhone,"The only way to stop drugs\, gangs\, human trafficking\, criminal elements and much else from coming into our Country is with a Wall or Barrier. Drones and all of the rest are wonderful and lots of fun\, but it is only a good old fashioned Wall that works!",,,,
Sun Dec 23 02:20:32 +0000 2018,115831,1.07666E+18,NULL,25501,Twitter for iPhone,"When President Obama ingloriously fired Jim Mattis\, I gave him a second chance. Some thought I shouldn’t\, I thought I should. Interesting relationship-but I also gave all of the resources that he never really had. Allies are very important-but not when they take advantage of U.S.",,,,
Sun Dec 23 01:59:29 +0000 2018,153603,1.07666E+18,NULL,33843,Twitter for iPhone,"If anybody but your favorite President\, Donald J. Trump\, announced that\, after decimating ISIS in Syria\, we were going to bring our troops back home (happy &amp; healthy)\, that person would be the most popular hero in America. With me\, hit hard instead by the Fake News Media. Crazy!",,,,
Sun Dec 23 01:48:23 +0000 2018,86619,1.07666E+18,NULL,19476,Twitter for iPhone,"Brett McGurk\, who I do not know\, was appointed by President Obama in 2015. Was supposed to leave in February but he just resigned prior to leaving. Grandstander? The Fake News is making such a big deal about this nothing event!",,,,
Sat Dec 22 23:58:43 +0000 2018,121172,1.07663E+18,NULL,23907,Twitter for iPhone,I will not be going to Florida because of the Shutdown - Staying in the White House!  #MAGA,,,,
Sat Dec 22 21:12:02 +0000 2018,64932,1.07659E+18,NULL,14231,Twitter for iPhone,Senate adjourns until December 27th.,,,,
Sat Dec 22 20:28:21 +0000 2018,175583,1.07658E+18,NULL,40152,Twitter for iPhone,"I won an election\, said to be one of the greatest of all time\, based on getting out of endless &amp; costly foreign wars &amp; also based on Strong Borders which will keep our Country safe. We fight for the borders of other countries\, but we won’t fight for the borders of our own!",,,,
Sat Dec 22 20:03:58 +0000 2018,111130,1.07657E+18,NULL,24788,Twitter for iPhone,The crisis of illegal activity at our Southern Border is real and will not stop until we build a great Steel Barrier or Wall. Let work begin!,,,,
Sat Dec 22 17:02:37 +0000 2018,93772,1.07652E+18,NULL,17276,Twitter for iPhone,Will be having lunch in White House residence with large group concerning Border Security.,,,,
Sat Dec 22 16:30:35 +0000 2018,117935,1.07652E+18,NULL,25454,Twitter for iPhone,"....going to be there for three months\, and that was seven years ago - we never left. When I became President\, ISIS was going wild. Now ISIS is largely defeated and other local countries\, including Turkey\, should be able to easily take care of whatever remains. We’re coming home!",,,,
