created_at,favorite_count,id_str,in_reply_to_user_id_str,retweet_count,source,text,,,,
Wed Oct 17 17:38:17 +0000 2018,39554,1.05261E+18,NULL,10806,Twitter Media Studio,https://t.co/CMxxW2fEDq,,,,
Wed Oct 17 17:29:30 +0000 2018,34063,1.05261E+18,NULL,8307,Twitter Media Studio,https://t.co/afqHydsMB5,,,,
Wed Oct 17 17:18:53 +0000 2018,35943,1.05261E+18,NULL,8878,Twitter for iPhone,“President Donald J. Trump is Following Through on His Promise to Cut Burdensome Red Tape and Unleash the American Economy”\nRead more: https://t.co/SrBaQzpq4E https://t.co/zF8fEsw3in,,,,
Wed Oct 17 17:11:48 +0000 2018,0,1.05261E+18,NULL,6378,Twitter for iPhone,RT @GOP: You can cast your ballot before Election Day in:\n➡️KS\n➡️NC\n➡️TN\nGet out and vote ➡️ https://t.co/YIO9A13Uio https://t.co/bxkCMApisn,,,,
Wed Oct 17 17:11:45 +0000 2018,0,1.05261E+18,NULL,4543,Twitter for iPhone,RT @GOP: TODAY is the LAST day to register to vote in Massachusetts and Wisconsin!\nRegister today ➡️ https://t.co/CZsNCAAomd https://t.co/3…,,,,
Wed Oct 17 13:48:25 +0000 2018,66398,1.05256E+18,NULL,17319,Twitter for iPhone,"Republicans must make the horrendous\, weak and outdated immigration laws\, and the Border\, a part of the Midterms!",,,,
Wed Oct 17 13:45:33 +0000 2018,85614,1.05256E+18,NULL,25401,Twitter for iPhone,"Hard to believe that with thousands of people from South of the Border\, walking unimpeded toward our country in the form of large Caravans\, that the Democrats won’t approve legislation that will allow laws for the protection of our country. Great Midterm issue for Republicans!",,,,
Wed Oct 17 12:40:15 +0000 2018,58839,1.05254E+18,NULL,14039,Twitter for iPhone,“Network News gave Zero coverage to the Big Day the Stock Market had yesterday.” @foxandfriends,,,,
Wed Oct 17 12:31:18 +0000 2018,75826,1.05254E+18,NULL,16936,Twitter for iPhone,August job openings hit a record 7.14 million. Congratulations USA!,,,,
Wed Oct 17 12:09:52 +0000 2018,59262,1.05253E+18,NULL,13921,Twitter for iPhone,AP headline was very different from my quote and meaning in the story. They just can’t help themselves. FAKE NEWS!,,,,
Wed Oct 17 12:00:11 +0000 2018,80076,1.05253E+18,NULL,20115,Twitter for iPhone,"Ted Cruz has done so much for Texas\, including massive cuts in taxes and regulations - which has brought Texas to the best jobs numbers in the history of the state. He watches carefully over your 2nd Amendment. O’Rourke would blow it all! Ted has long had my Strong Endorsement!",,,,
Wed Oct 17 11:52:19 +0000 2018,78161,1.05253E+18,NULL,20321,Twitter for iPhone,"Watched the debate last night &amp; Beto O’Rourke\, who wants higher taxes and far more regulations\, is not in the same league with Ted Cruz &amp; what the great people of Texas stand for &amp; want. Ted is strong on Crime\, Border &amp; 2nd A\, loves our Military\, Vets\, Low Taxes. Beto is a Flake!",,,,
Wed Oct 17 11:30:21 +0000 2018,87996,1.05252E+18,NULL,22603,Twitter for iPhone,"“Trump could be the most honest president in modern history. When you look at the real barometer of presidential truthfulness\, which is promise keeping\, he is probably the most honest president in American history. He’s done exactly what he said he would do.” Marc Thiessen\, WPost",,,,
Wed Oct 17 02:39:24 +0000 2018,70215,1.05239E+18,NULL,13600,Twitter for iPhone,"Stock Market up 548 points today. Also\, GREAT jobs numbers!",,,,
Wed Oct 17 02:36:30 +0000 2018,91859,1.05239E+18,NULL,20544,Twitter for iPhone,"Elizabeth Warren is being hammered\, even by the Left. Her false claim of Indian heritage is only selling to VERY LOW I.Q. individuals!",,,,
Wed Oct 17 01:24:30 +0000 2018,170768,1.05237E+18,NULL,42553,Twitter for iPhone,"Anybody entering the United States illegally will be arrested and detained\, prior to being sent back to their country!",,,,
Wed Oct 17 01:19:20 +0000 2018,134998,1.05237E+18,NULL,36164,Twitter for iPhone,"We have today informed the countries of Honduras\, Guatemala and El Salvador that if they allow their citizens\, or others\, to journey through their borders and up to the United States\, with the intention of entering our country illegally\, all payments made to them will STOP (END)!",,,,
Tue Oct 16 23:43:42 +0000 2018,44908,1.05234E+18,NULL,8215,Twitter for iPhone,"I will be interviewed tonight by Trish Regan on @FoxBusiness at 8:00 P.M.\, right after the great Lou Dobbs!",,,,
Tue Oct 16 23:28:44 +0000 2018,0,1.05234E+18,NULL,7162,Twitter for iPhone,RT @FoxBusiness: TONIGHT: @POTUS talks 2020 election in an exclusive interview with @trish_regan. Don't miss the full interview on 'Trish R…,,,,
Tue Oct 16 18:50:54 +0000 2018,97159,1.05227E+18,NULL,27033,Twitter for iPhone,"WOW\, John James is making headway in Michigan. We are bringing jobs back to the State\, and the People of Michigan appreciate it. Debbie Stabenow has been no help\, if anything\, a major hindrance. John James is a star\, I hope the voters see it. Polls are tightening!",,,,
Tue Oct 16 18:40:19 +0000 2018,44451,1.05227E+18,25073877,10273,Twitter for iPhone,"...during the call\, and told me that he has already started\, and will rapidly expand\, a full and complete investigation into this matter. Answers will be forthcoming shortly.",,,,
Tue Oct 16 18:40:18 +0000 2018,52922,1.05227E+18,NULL,13828,Twitter for iPhone,Just spoke with the Crown Prince of Saudi Arabia who totally denied any knowledge of what took place in their Turkish Consulate. He was with Secretary of State Mike Pompeo...,,,,
Tue Oct 16 16:22:11 +0000 2018,43910,1.05223E+18,NULL,12848,Twitter for iPhone,REGISTER TO https://t.co/0pWiwCHGbh! #MAGA🇺🇸 https://t.co/ACTMe53TZU,,,,
Tue Oct 16 16:18:08 +0000 2018,0,1.05223E+18,NULL,11200,Twitter for iPhone,RT @WhiteHouse: https://t.co/RNqLpOtS3O,,,,
Tue Oct 16 15:26:33 +0000 2018,82900,1.05222E+18,NULL,24807,Twitter for iPhone,"Is it really possible that Bruce Ohr\, whose wife Nellie was paid by Simpson and GPS Fusion for work done on the Fake Dossier\, and who was used as a Pawn in this whole SCAM (WITCH HUNT)\, is still working for the Department of Justice????? Can this really be so?????",,,,
Tue Oct 16 15:18:51 +0000 2018,46688,1.05222E+18,25073877,12973,Twitter for iPhone,“Conflict between Glen Simpson’s testimony to another House Panel about his contact with Justice Department official Bruce Ohr. Ohr was used by Simpson and Steele as a Back Channel to get (FAKE) Dossier to FBI. Simpson pleading Fifth.” Catherine Herridge. Where is Jeff Sessions?,,,,
Tue Oct 16 15:04:32 +0000 2018,122638,1.05221E+18,NULL,28414,Twitter for iPhone,"“Federal Judge throws out Stormy Danials lawsuit versus Trump. Trump is entitled to full legal fees.” @FoxNews Great\, now I can go after Horseface and her 3rd rate lawyer in the Great State of Texas. She will confirm the letter she signed! She knows nothing about me\, a total con!",,,,
Tue Oct 16 14:12:06 +0000 2018,89441,1.0522E+18,NULL,22836,Twitter for iPhone,"Incredible number just out\, 7\,036\,000 job openings. Astonishing - it’s all working! Stock Market up big on tremendous potential of USA. Also\, Strong Profits. We are Number One in World\, by far!",,,,
Tue Oct 16 13:15:18 +0000 2018,77598,1.05219E+18,NULL,20394,Twitter for iPhone,"For the record\, I have no financial interests in Saudi Arabia (or Russia\, for that matter). Any suggestion that I have is just more FAKE NEWS (of which there is plenty)!",,,,
Tue Oct 16 13:08:24 +0000 2018,68976,1.05218E+18,NULL,15776,Twitter for iPhone,“8X more new manufacturing jobs now than with Obama.” @FoxNews  @cvpayne,,,,
Tue Oct 16 13:05:04 +0000 2018,143613,1.05218E+18,NULL,42070,Twitter for iPhone,"The United States has strongly informed the President of Honduras that if the large Caravan of people heading to the U.S. is not stopped and brought back to Honduras\, no more money or aid will be given to Honduras\, effective immediately!",,,,
Tue Oct 16 12:55:38 +0000 2018,52994,1.05218E+18,NULL,13410,Twitter for iPhone,"“Op-Ed praises Trump Administrations efforts at the Border.” @FoxNews  The  Washington Examiner States\, “Finally\, the government has taken steps to stop releasing unaccompanied minors to criminals and traffickers.” This was done by the Obama Administration!",,,,
Tue Oct 16 12:24:51 +0000 2018,122783,1.05217E+18,NULL,29846,Twitter for iPhone,"Thank you to the Cherokee Nation for revealing that Elizabeth Warren\, sometimes referred to as Pocahontas\, is a complete and total Fraud!",,,,
Tue Oct 16 12:16:35 +0000 2018,91857,1.05217E+18,NULL,22831,Twitter for iPhone,"Now that her claims of being of Indian heritage have turned out to be a scam and a lie\, Elizabeth Warren should apologize for perpetrating this fraud against the American Public. Harvard called her “a person of color” (amazing con)\, and would not have taken her otherwise!",,,,
Tue Oct 16 12:06:31 +0000 2018,121754,1.05217E+18,NULL,28140,Twitter for iPhone,"Pocahontas (the bad version)\, sometimes referred to as Elizabeth Warren\, is getting slammed. She took a bogus DNA test and it showed that she may be 1/1024\, far less than the average American. Now Cherokee Nation denies her\, “DNA test is useless.” Even they don’t want her. Phony!",,,,
Tue Oct 16 00:26:23 +0000 2018,85114,1.05199E+18,NULL,18861,Twitter for iPhone,"TOGETHER\, WE WILL PREVAIL! https://t.co/C1TLMVkDmt",,,,
Mon Oct 15 23:51:59 +0000 2018,76165,1.05198E+18,NULL,20232,Twitter for iPhone,Open enrollment starts today on lower-priced Medicare Advantage plans so loved by our great seniors. Crazy Bernie and his band of Congressional Dems will outlaw these plans. Disaster!,,,,
Mon Oct 15 22:27:00 +0000 2018,0,1.05196E+18,NULL,10508,Twitter for iPhone,"RT @WhiteHouse: Thank you to the law enforcement\, first responders\, and state\, local\, and Federal officials who are helping in recovery eff…",,,,
Mon Oct 15 22:03:23 +0000 2018,0,1.05196E+18,NULL,9147,Twitter for iPhone,RT @WhiteHouse: \First responders\, @fema\, the job they've done is incredible\,"\"" President @realDonaldTrump said as he toured damage from #Hu…""",
Mon Oct 15 15:45:43 +0000 2018,71582,1.05186E+18,NULL,12979,Twitter for iPhone,Just arrived in Florida. Also thinking about our GREAT Alabama farmers and our many friends in North and South Carolina today. We are with you!,,,,
Mon Oct 15 13:48:13 +0000 2018,64737,1.05183E+18,NULL,9396,Twitter for iPhone,On our way to Florida and Georgia!,,,,
Mon Oct 15 12:37:05 +0000 2018,83290,1.05181E+18,NULL,21273,Twitter for iPhone,Just spoke to the King of Saudi Arabia who denies any knowledge of whatever may have happened “to our Saudi Arabian citizen.” He said that they are working closely with Turkey to find answer. I am immediately sending our Secretary of State to meet with King!,,,,
Mon Oct 15 12:25:13 +0000 2018,62217,1.05181E+18,NULL,11710,Twitter for iPhone,"Will be leaving for Florida and Georgia with the First Lady to tour the hurricane damage and visit with FEMA\, First Responders and Law Enforcement. Maximum effort is taking place\, everyone is working very hard. Worst hit in 50 years!",,,,
Mon Oct 15 12:11:29 +0000 2018,117484,1.05181E+18,NULL,28046,Twitter for iPhone,"The crowds at my Rallies are far bigger than they have ever been before\, including the 2016 election. Never an empty seat in these large venues\, many thousands of people watching screens outside. Enthusiasm &amp; Spirit is through the roof. SOMETHING BIG IS HAPPENING - WATCH!",,,,
Mon Oct 15 11:46:39 +0000 2018,100364,1.0518E+18,NULL,26942,Twitter for iPhone,“The only way to shut down the Democrats new Mob Rule strategy is to stop them cold at the Ballot Box. The fight for America’s future is never over!” Ben Shapiro,,,,
Sun Oct 14 22:44:59 +0000 2018,0,1.0516E+18,NULL,12126,Twitter for iPhone,"RT @realDonaldTrump: I will be interviewed on “60 Minutes” tonight at 7:00 P.M.\, after NFL game. Enjoy!",,,,
Sun Oct 14 19:54:20 +0000 2018,77749,1.05156E+18,NULL,18641,Twitter for iPhone,Thank you to NBC for the correction! https://t.co/L2mX3vREOl,,,,
Sun Oct 14 19:45:05 +0000 2018,74452,1.05156E+18,NULL,15753,Twitter for iPhone,Thank you! https://t.co/CrExOML9Mi,,,,
Sun Oct 14 19:44:20 +0000 2018,0,1.05156E+18,NULL,7675,Twitter for iPhone,RT @IVT2020: @realDonaldTrump https://t.co/cvYbnieQ4H,,,,
Sun Oct 14 19:39:16 +0000 2018,71664,1.05156E+18,NULL,12126,Twitter for iPhone,"I will be interviewed on “60 Minutes” tonight at 7:00 P.M.\, after NFL game. Enjoy!",,,,
Sun Oct 14 18:06:16 +0000 2018,14066,1.05153E+18,NULL,3645,Twitter for iPhone,Will be interviewed tonight by @LesleyRStahl on @60Minutes @CBSNews at 7:30 P.M. Eastern. Enjoy! https://t.co/eUTAP0u0Uh,,,,
Sun Oct 14 14:02:07 +0000 2018,70726,1.05147E+18,NULL,10345,Twitter for iPhone,"Princess Eugenie of York was a truly beautiful bride yesterday. She has been through so much\, and has come out a total winner!",,,,
Sun Oct 14 13:56:12 +0000 2018,117653,1.05147E+18,NULL,30920,Twitter for iPhone,"NBC News has totally and purposely changed the point and  meaning of my story about General Robert E Lee and General Ulysses Grant. Was actually a shoutout to warrior Grant and the great state in which he was born. As usual\, dishonest reporting. Even mainstream media embarrassed!",,,,
Sun Oct 14 03:53:09 +0000 2018,100420,1.05132E+18,NULL,20295,Twitter for iPhone,"Congratulations to Tucker Carlson on the great success of his book\, “Ship of Fools.” It just went to NUMBER ONE!",,,,
Sun Oct 14 03:42:43 +0000 2018,87639,1.05132E+18,NULL,16885,Twitter for iPhone,"Big day! Pastor Andrew Brunson\, who could have spent 35 years in a Turkish prison\, was returned safely home to his family today. Met in Oval Office\, great people! Then off to Kentucky for a Rally for Congressman Andy Barr. Tremendous crowd &amp; spirit! Just returned to White House.",,,,
Sun Oct 14 01:16:43 +0000 2018,55710,1.05128E+18,NULL,12754,Twitter for iPhone,Thank you Kentucky! #MAGA🇺🇸\nhttps://t.co/iCUqrQ91gF https://t.co/xwsa1S2dIU,,,,
Sat Oct 13 21:06:19 +0000 2018,46627,1.05122E+18,NULL,9896,Twitter for iPhone,"On my way to Richmond\, Kentucky for a MAKE AMERICA GREAT AGAIN rally at 7:00pmE. The crowds are once again\, massive. See everyone in a couple of hours! #MAGA https://t.co/D1FYNgW0nL https://t.co/d0VBFeePLk",,,,
Sat Oct 13 20:48:09 +0000 2018,86481,1.05121E+18,NULL,19823,Twitter for iPhone,WELCOME HOME PASTOR ANDREW BRUNSON! https://t.co/HijeAGU1gy,,,,
Sat Oct 13 20:42:22 +0000 2018,50809,1.05121E+18,NULL,11524,Twitter for iPhone,https://t.co/uIaENHQoPK,,,,
Sat Oct 13 17:52:26 +0000 2018,72264,1.05117E+18,NULL,15940,Twitter for iPhone,"Heading to the Great State of Kentucky - Big Rally for Congressman Andy Barr - Fantastic guy\, need his vote for MAGA! Strong on Crime\, Tax Cuts\, Military\, Vets &amp; 2nd A. His opponent will NEVER vote for us\, only for Pelosi. Andy has my Strongest Endorsement!!! See you in Kentucky.",,,,
Sat Oct 13 17:43:02 +0000 2018,91501,1.05117E+18,NULL,26519,Twitter for iPhone,"Highly respected Congressman Keith Rothfus (R) of Pennsylvania is in the fight of his life because the Dems changed the District Map. He must win. Strong on crime\, borders\, big tax &amp; reg cuts\, Military &amp; Vets. Opponent Lamb a Pelosi puppet-weak on crime. BIG ENDORSEMENT FOR KEITH",,,,
Sat Oct 13 17:03:06 +0000 2018,73661,1.05116E+18,NULL,14849,Twitter for iPhone,“From a Turkish prison to the White House in 24 hours.”  Kristin Fisher of @FoxNews   Very cool!,,,,
Sat Oct 13 14:17:57 +0000 2018,101249,1.05111E+18,NULL,24261,Twitter for iPhone,"There was NO DEAL made with Turkey for the release and return of Pastor Andrew Brunson. I don’t make deals for hostages. There was\, however\, great appreciation on behalf of the United States\, which will lead to good\, perhaps great\, relations between the United States &amp; Turkey!",,,,
Sat Oct 13 14:06:26 +0000 2018,75130,1.05111E+18,NULL,16916,Twitter for iPhone,"Pastor Andrew Brunson\, released by Turkey\, will be with me in the Oval Office at 2:30 P.M. (this afternoon). It will be wonderful to see and meet him. He is a great Christian who has been through such a tough experience. I would like to thank President @RT_Erdogan for his help!",,,,
Sat Oct 13 13:31:27 +0000 2018,57185,1.0511E+18,NULL,12713,Twitter for iPhone,Happy 243rd Birthday to our GREAT @USNavy! #243NavyBday https://t.co/m1YtoKSHFw,,,,
Sat Oct 13 01:17:01 +0000 2018,0,1.05092E+18,NULL,11257,Twitter for iPhone,"RT @realDonaldTrump: Don’t miss our GREAT @FLOTUS\, Melania\, on @ABC @ABC2020 tonight at 10pmE. Enjoy!",,,,
Sat Oct 13 00:30:16 +0000 2018,48028,1.05091E+18,NULL,10638,Twitter for iPhone,"Beautiful MAKE AMERICA GREAT AGAIN rally in Lebanon\, Ohio. Thank you! #ICYMI\, watch here: https://t.co/UGQAmARPKR https://t.co/6nsoV8yTx3",,,,
Fri Oct 12 22:14:44 +0000 2018,87883,1.05087E+18,NULL,21564,Twitter for iPhone,"The GREAT football (and lacrosse) player\, Jim Brown outside the West Wing of the @WhiteHouse. He is also a tremendous man and mentor to many young people! https://t.co/yo7MxoGL6C",,,,
Fri Oct 12 22:02:19 +0000 2018,45161,1.05087E+18,NULL,10396,Twitter for iPhone,https://t.co/HHTwwbuKa2,,,,
Fri Oct 12 21:30:27 +0000 2018,0,1.05086E+18,NULL,8953,Twitter for iPhone,RT @WhiteHouse: https://t.co/IqLBKtgNEf,,,,
Fri Oct 12 19:37:27 +0000 2018,38336,1.05083E+18,NULL,8398,Twitter for iPhone,Happy #NationalFarmersDay! With the recent #USMCA our GREAT FARMERS will do better than ever before!! https://t.co/PMS4z2EScY,,,,
Fri Oct 12 19:10:51 +0000 2018,57063,1.05083E+18,NULL,11251,Twitter for iPhone,"Don’t miss our GREAT @FLOTUS\, Melania\, on @ABC @ABC2020 tonight at 10pmE. Enjoy!",,,,
Fri Oct 12 18:09:17 +0000 2018,82790,1.05081E+18,NULL,16976,Twitter for iPhone,People have no idea how hard Hurricane Michael has hit the great state of Georgia. I will be visiting both Florida and Georgia early next week. We are working very hard on every area and every state that was hit - we are with you!,,,,
Fri Oct 12 16:43:13 +0000 2018,60597,1.05079E+18,NULL,18566,Twitter for iPhone,"PROMISES MADE\, PROMISES KEPT! https://t.co/2lk8Fjspe4",,,,
Fri Oct 12 15:57:52 +0000 2018,43308,1.05078E+18,NULL,13815,Twitter for iPhone,REGISTER TO VOTE! https://t.co/0pWiwCHGbh https://t.co/EOCLoJJ24B,,,,
Fri Oct 12 14:26:00 +0000 2018,125672,1.05075E+18,NULL,27625,Twitter for iPhone,PASTOR BRUNSON JUST RELEASED. WILL BE HOME SOON!,,,,
Fri Oct 12 13:59:06 +0000 2018,77930,1.05075E+18,NULL,13840,Twitter for iPhone,"My thoughts and prayers are with Pastor Brunson\, and we hope to have him safely back home soon!",,,,
Fri Oct 12 13:54:46 +0000 2018,76446,1.05075E+18,NULL,14131,Twitter for iPhone,"So nice\, everyone wants Ivanka Trump to be the new United Nations Ambassador. She would be incredible\, but I can already hear the chants of Nepotism! We have great people that want the job.",,,,
Fri Oct 12 13:42:04 +0000 2018,68058,1.05074E+18,NULL,12514,Twitter for iPhone,Working very hard on Pastor Brunson!,,,,
Thu Oct 11 22:49:26 +0000 2018,0,1.05052E+18,NULL,6839,Twitter for iPhone,"RT @FLGuard: There are serious communication issues in the Panhandle after #HurricaneMichael. If you are worried about someone\, visit https…",,,,
Thu Oct 11 22:14:23 +0000 2018,0,1.05051E+18,NULL,6122,Twitter for iPhone,RT @WhiteHouse: President Trump provides an update on the response to Hurricane Michael: https://t.co/zmnHXKakYw,,,,
Thu Oct 11 17:23:27 +0000 2018,0,1.05044E+18,NULL,15619,Twitter for iPhone,"RT @WhiteHouse: Moments ago\, President Trump signed the Music Modernization Act\, which will close loopholes in our digital royalty laws to…",,,,
Thu Oct 11 16:21:53 +0000 2018,42377,1.05042E+18,NULL,9063,Media Studio,https://t.co/xJ9QYGMJXa,,,,
Thu Oct 11 14:43:33 +0000 2018,38898,1.0504E+18,NULL,8973,Media Studio,https://t.co/rsxEwbFZht,,,,
Thu Oct 11 14:41:01 +0000 2018,39414,1.0504E+18,NULL,8797,Media Studio,https://t.co/h47S6T9u8V,,,,
Thu Oct 11 03:44:00 +0000 2018,83413,1.05023E+18,NULL,18518,Twitter for iPhone,"Florida Highway Patrol Troopers are all en route to the Panhandle\, from all across the state of Florida - to help those affected by #HurricaneMichael. If you see them\, be sure to shake their hands and say THANK YOU! #LESM https://t.co/rB7uNBudY5",,,,
Thu Oct 11 01:35:15 +0000 2018,48376,1.0502E+18,NULL,9842,Twitter for iPhone,Thank you to @FEMA and all First Responders! #HurricaneMichael https://t.co/vwN8BbrkkJ,,,,
Thu Oct 11 01:33:21 +0000 2018,47413,1.0502E+18,NULL,10402,Twitter for iPhone,Thank you Jacksonville Sheriff’s Office! #HurricaneMichael https://t.co/fuy7stLMJI,,,,
Thu Oct 11 01:00:18 +0000 2018,92539,1.05019E+18,NULL,23802,Twitter for iPhone,"Massive overflow crowd tonight in Erie\, Pennsylvania. THANK YOU to everyone who came out and joined us. Together\, we are MAKING AMERICA GREAT AGAIN! https://t.co/FkPNNVpccX",,,,
Thu Oct 11 00:52:29 +0000 2018,46233,1.05019E+18,NULL,11285,Twitter for iPhone,"Thank you Erie\, Pennsylvania! Remember to get out and VOTE! #MAGA🇺🇸 https://t.co/X8IEW8h9qP",,,,
Wed Oct 10 22:33:48 +0000 2018,0,1.05015E+18,NULL,3700,Twitter for iPhone,RT @fema: It’s extremely important to keep sheltering in a safe place and to stay aware as #Michael continues to move inland! https://t.co/…,,,,
Wed Oct 10 22:33:37 +0000 2018,0,1.05015E+18,NULL,3249,Twitter for iPhone,"RT @USNationalGuard: LIVE UPDATE: @AlabamaNG\, @GeorgiaGuard\, @FLGuard and @NCNationalGuard vehicles and personnel are staged and ready to p…",,,,
Wed Oct 10 21:05:08 +0000 2018,0,1.05013E+18,NULL,4652,Twitter for iPhone,"RT @WhiteHouse: Earlier today: President @realDonaldTrump\, joined by Homeland Security @SecNielsen\, listens as @FEMA_Brock briefs reporters…",,,,
Wed Oct 10 21:01:55 +0000 2018,53981,1.05013E+18,NULL,11788,Twitter for iPhone,Couldn’t let these great people down. They have been lined up since last night - see you soon Pennsylvania! https://t.co/jSrsmncw85,,,,
Wed Oct 10 19:52:23 +0000 2018,80036,1.05011E+18,NULL,14890,Twitter for iPhone,"Departing the @WhiteHouse for Erie\, Pennsylvania. I cannot disappoint the thousands of people that are there - and the thousands that are going. I look forward to seeing everyone this evening.",,,,
Wed Oct 10 17:39:59 +0000 2018,0,1.05008E+18,NULL,9280,Twitter for iPhone,"RT @USATODAY: .@usatodayopinion: Democrats want to outlaw private health care plans\, taking away freedom to choose plans while letting anyo…",,,,
Wed Oct 10 16:52:17 +0000 2018,0,1.05007E+18,NULL,5454,Twitter for iPhone,"RT @FLGuard: #HurricaneMichael is here\, but so are we. Stay safe\, Florida. #FloridaFirst #FLNGAlwaysThere https://t.co/e2rVNXFERp",,,,
Wed Oct 10 16:43:12 +0000 2018,0,1.05006E+18,NULL,7141,Twitter for iPhone,"RT @EricTrump: All my friends in Missouri\, today is your LAST CHANCE to register to vote this November! It is very easy to do - simply go t…",,,,
Wed Oct 10 16:05:55 +0000 2018,53793,1.05005E+18,NULL,12172,Twitter for iPhone,We are with you Florida! https://t.co/qzrVLeFbyF\nhttps://t.co/HVVhSmBg7S https://t.co/rcB6OCwLeH,,,,
Wed Oct 10 13:01:05 +0000 2018,93308,1.05001E+18,NULL,25499,Twitter for iPhone,"Despite so many positive events and victories\, Media Reseach Center reports that 92% of stories on Donald Trump are negative on ABC\, CBS and ABC. It is FAKE NEWS! Don’t worry\, the Failing New York Times didn’t even put the Brett Kavanaugh victory on the Front Page yesterday-A17!",,,,
Wed Oct 10 12:50:56 +0000 2018,0,1.05001E+18,NULL,4057,Twitter for iPhone,"RT @NHC_Surge: A destructive and life-threatening storm surge event will occur along portions of the Florida Panhandle\, Big Bend\, and Natur…",,,,
Wed Oct 10 12:50:06 +0000 2018,0,1.05001E+18,NULL,2816,Twitter for iPhone,"RT @FAANews: Due to #HurricaneMichael\, flights in your area could be delayed and possibly cancelled. Please continue to check the status of…",,,,
Wed Oct 10 12:49:08 +0000 2018,0,1.05001E+18,NULL,3060,Twitter for iPhone,RT @FLSERT: Hurricane shelter locations are accessible from: https://t.co/Hop887IoiC #HurricaneMichael https://t.co/Ljk8boFaSw,,,,
Wed Oct 10 12:48:59 +0000 2018,0,1.05001E+18,NULL,2980,Twitter for iPhone,"RT @NHC_Atlantic: Hurricane #Michael.  In addition to the life-threatening storm surge and wind impacts\, heavy rainfall is expected across…",,,,
Wed Oct 10 12:48:41 +0000 2018,0,1.05001E+18,NULL,2983,Twitter for iPhone,RT @NHC_Atlantic: Hurricane force winds are expected to extend well inland over portions of the Florida Panhandle and portions of southeast…,,,,
Wed Oct 10 12:48:26 +0000 2018,0,1.05001E+18,NULL,2553,Twitter for iPhone,"RT @NHC_Atlantic: A Storm Surge Warning remains in effect for much of the Florida Panhandle and Big Bend region\, where life-threatening sto…",,,,
Wed Oct 10 12:48:11 +0000 2018,0,1.05001E+18,NULL,2359,Twitter for iPhone,RT @NHC_Atlantic: NHC Director Ken Graham will provide a Facebook Live broadcast regarding Category 4 Hurricane #Michael at 8:45 a.m. EDT (…,,,,
Wed Oct 10 12:47:57 +0000 2018,0,1.05001E+18,NULL,4417,Twitter for iPhone,"RT @fema: As Hurricane #Michael nears land\, take shelter &amp; stay safe.\n\n📱Follow weather updates on your phone or radio.\n\n🔹 In a tornado WARN…",,,,
Wed Oct 10 12:47:01 +0000 2018,57022,1.05E+18,NULL,14545,Twitter for iPhone,Walker Stapleton is running as the highly respected Republican Candidate for Governor of the Great State of Colorado. His credentials and talents are impeccable. He has my complete and total Endorsement!,,,,
Wed Oct 10 02:28:10 +0000 2018,0,1.04985E+18,NULL,9412,Twitter for iPhone,"RT @FLGovScott: If you’re in an evacuation zone\, I am urging you to leave RIGHT NOW. Do not risk your life or the lives of your loved ones-…",,,,
Wed Oct 10 01:23:49 +0000 2018,54312,1.04983E+18,NULL,13172,Twitter for iPhone,"THANK YOU IOWA &amp; NEBRASKA! VOTE\, VOTE\, VOTE! https://t.co/0pWiwCHGbh https://t.co/tzkiQ4IlEd",,,,
Wed Oct 10 01:18:12 +0000 2018,34233,1.04983E+18,NULL,8122,Twitter for iPhone,https://t.co/CPf3oxgdRX,,,,
