created_at,favorite_count,id_str,in_reply_to_user_id_str,retweet_count,source,text,,,,
Fri May 18 22:57:09 +0000 2018,99464,9.97612E+17,NULL,20200,Twitter for iPhone,"America is blessed with extraordinary energy abundance\, including more than 250 years worth of beautiful clean coal. We have ended the war on coal\, and will continue to work to promote American energy dominance!",,,,
Fri May 18 22:00:58 +0000 2018,102430,9.97598E+17,NULL,25000,Twitter for iPhone,"California finally deserves a great Governor\, one who understands borders\, crime and lowering taxes. John Cox is the man - he’ll be the best Governor you’ve ever had. I fully endorse John Cox for Governor and look forward to working with him to Make California Great Again!",,,,
Fri May 18 20:41:21 +0000 2018,52364,9.97578E+17,NULL,10937,Twitter for iPhone,"Just met with UN Secretary-General António Guterres who is working hard to “Make the United Nations Great Again.” When the UN does more to solve conflicts around the world\, it means the U.S. has less to do and we save money. @NikkiHaley is doing a fantastic job! https://t.co/pqUv6cyH2z",,,,
Fri May 18 20:22:25 +0000 2018,61820,9.97573E+17,NULL,14474,Twitter for iPhone,America is a Nation that believes in the power of redemption. America is a Nation that believes in second chances - and America is a Nation that believes that the best is always yet to come! #PrisonReform https://t.co/Yk5UJUYgHN,,,,
Fri May 18 20:02:49 +0000 2018,0,9.97568E+17,NULL,8268,Twitter for iPhone,RT @SteveForbesCEO: .@realDonaldTrump speech on drug costs pays immediate dividends. New @Amgen drug lists at 30% less than expected. Middl…,,,,
Fri May 18 16:34:24 +0000 2018,81252,9.97516E+17,NULL,17833,Twitter for iPhone,"We grieve for the terrible loss of life\, and send our support and love to everyone affected by this horrible attack in Texas. To the students\, families\, teachers and personnel at Santa Fe High School – we are with you in this tragic hour\, and we will be with you forever... https://t.co/LtJ0D29Hsv",,,,
Fri May 18 15:05:35 +0000 2018,94775,9.97493E+17,NULL,17610,Twitter for iPhone,School shooting in Texas. Early reports not looking good. God bless all!,,,,
Fri May 18 13:50:11 +0000 2018,89902,9.97474E+17,NULL,27122,Twitter for iPhone,"Reports are there was indeed at least one FBI representative implanted\, for political purposes\, into my campaign for president. It took place very early on\, and long before the phony Russia Hoax became a “hot” Fake News story. If true - all time biggest political scandal!",,,,
Fri May 18 13:38:11 +0000 2018,88886,9.97471E+17,NULL,24058,Twitter for iPhone,"Why isn’t disgraced FBI official Andrew McCabe being investigated for the $700\,000 Crooked Hillary Democrats in Virginia\, led by Clinton best friend Terry M (under FBI investigation that they killed) gave to McCabe’s wife in her run for office? Then dropped case on Clinton!",,,,
Fri May 18 10:51:43 +0000 2018,160867,9.9743E+17,NULL,43408,Twitter for iPhone,"Fake News Media had me calling Immigrants\, or Illegal Immigrants\, “Animals.” Wrong! They were begrudgingly forced to withdraw their stories. I referred to MS 13 Gang Members as “Animals\,” a big difference - and so true. Fake News got it purposely wrong\, as usual!",,,,
Fri May 18 10:24:53 +0000 2018,75730,9.97423E+17,NULL,21466,Twitter for iPhone,"“Apparently the DOJ put a Spy in the Trump Campaign. This has never been done before and by any means necessary\, they are out to frame Donald Trump for crimes he didn’t commit.”  David Asman  @LouDobbs @GreggJarrett   Really bad stuff!",,,,
Thu May 17 23:44:23 +0000 2018,0,9.97262E+17,NULL,37887,Twitter for iPhone,RT @WhiteHouse: #Laurel? #Yanny? Or... https://t.co/5hth07SdGY,,,,
Thu May 17 22:17:08 +0000 2018,72082,9.9724E+17,NULL,13429,Twitter for iPhone,It was my great honor to visit with our HEROES last night at Walter Reed Medical Center. There is nobody like them! https://t.co/fG5W1SwIHK,,,,
Thu May 17 22:14:23 +0000 2018,73335,9.97239E+17,NULL,14313,Twitter for iPhone,"Tomorrow\, the House will vote on a strong Farm Bill\, which includes work requirements. We must support our Nation’s great farmers!",,,,
Thu May 17 21:53:51 +0000 2018,82601,9.97234E+17,NULL,16782,Twitter for iPhone,Great talk with my friend President Mauricio Macri of Argentina this week. He is doing such a good job for Argentina. I support his vision for transforming his country’s economy and unleashing its potential!,,,,
Thu May 17 21:27:52 +0000 2018,43309,9.97227E+17,NULL,8042,Twitter for iPhone,"Talking trade with the Vice Premier of the People’s Republic of China\, Liu He. https://t.co/9T7Iq6F3Xe",,,,
Thu May 17 21:00:12 +0000 2018,83891,9.9722E+17,NULL,18885,Twitter for iPhone,"Congratulations to our new CIA Director\, Gina Haspel! https://t.co/n1xj9LSV9D",,,,
Thu May 17 15:25:57 +0000 2018,80528,9.97136E+17,NULL,19148,Twitter for iPhone,Congrats to the House for passing the VA MISSION Act yesterday. Without this funding our veterans will be forced to stand in never ending lines in order to receive care. Putting politics over our veterans care is UNACCEPTABLE – Senate must vote yes on this bill by Memorial Day!,,,,
Thu May 17 13:52:44 +0000 2018,137132,9.97113E+17,NULL,32409,Twitter for iPhone,"Despite the disgusting\, illegal and unwarranted Witch Hunt\, we have had the most successful first 17 month Administration in U.S. history - by far! Sorry to the Fake News Media and “Haters\,” but that’s the way it is!",,,,
Thu May 17 12:45:03 +0000 2018,115217,9.97096E+17,NULL,34113,Twitter for iPhone,"Wow\, word seems to be coming out that the Obama FBI “SPIED ON THE TRUMP CAMPAIGN WITH AN EMBEDDED INFORMANT.” Andrew McCarthy says\, “There’s probably no doubt that they had at least one confidential informant in the campaign.” If so\, this is bigger than Watergate!",,,,
Thu May 17 11:56:15 +0000 2018,27591,9.97083E+17,NULL,8933,Twitter for iPhone,"Wow\, word seems to be coming out that the Obama FBI “SPIED ON THE TRUMP CAMPAIGN WITH AN IMBEDDED INFORMANT.” Andrew McCarthy says\, “There’s probably no doubt that they had at least one confidential informant in the campaign.” If so\, this is bigger than Watergate!",,,,
Thu May 17 11:28:09 +0000 2018,125633,9.97076E+17,NULL,30199,Twitter for iPhone,"Congratulations America\, we are now into the second year of the greatest Witch Hunt in American History...and there is still No Collusion and No Obstruction. The only Collusion was that done by Democrats who were unable to win an Election despite the spending of far more money!",,,,
Wed May 16 22:57:25 +0000 2018,82321,9.96887E+17,NULL,17153,Twitter for iPhone,Gina Haspel is one step closer to leading our brave men and women at the CIA. She is exceptionally qualified and the Senate should confirm her immediately. We need her to keep our great country safe! #ConfirmGina,,,,
Wed May 16 18:40:36 +0000 2018,44552,9.96823E+17,25073877,9557,Twitter for iPhone,"...and voted against the massive Tax Cut Bill. He’s also weak on borders and crime. Sadly\, our great Military and Vets mean nothing to Bobby Jr. Lou Barletta will win! #MAGA",,,,
Wed May 16 18:40:35 +0000 2018,57936,9.96823E+17,NULL,14350,Twitter for iPhone,"Lou Barletta will be a great Senator for Pennsylvania but his opponent\, Bob Casey\, has been a do-nothing Senator who only shows up at election time. He votes along the Nancy Pelosi\, Elizabeth Warren lines\, loves sanctuary cities\, bad and expensive healthcare...",,,,
Wed May 16 17:50:58 +0000 2018,46023,9.9681E+17,NULL,8504,Twitter for iPhone,"Today\, it was my great honor to welcome President Mirziyoyev of Uzbekistan to the @WhiteHouse! https://t.co/3EkHChjnYA",,,,
Wed May 16 17:21:18 +0000 2018,69022,9.96803E+17,NULL,15110,Twitter for iPhone,"House votes today on Choice/MISSION Act. Who will stand with our Great Vets\, caregivers\, and Veterans Service Organizations? Must get Choice passed by Memorial Day!",,,,
Wed May 16 13:09:20 +0000 2018,47640,9.96739E+17,25073877,9560,Twitter for iPhone,"...haven’t even started yet! The U.S. has very little to give\, because it has given so much over the years. China has much to give!",,,,
Wed May 16 13:09:20 +0000 2018,44044,9.96739E+17,25073877,8977,Twitter for iPhone,"...We have not seen China’s demands yet\, which should be few in that previous U.S. Administrations have done so poorly in negotiating. China has seen our demands. There has been no folding as the media would love people to believe\, the meetings...",,,,
Wed May 16 13:09:19 +0000 2018,58814,9.96739E+17,NULL,13454,Twitter for iPhone,The Washington Post and CNN have typically written false stories about our trade negotiations with China. Nothing has happened with ZTE except as it pertains to the larger trade deal. Our country has been losing hundreds of billions of dollars a year with China...,,,,
Wed May 16 12:25:42 +0000 2018,65164,9.96728E+17,NULL,12282,Twitter for iPhone,Congratulations to Deb Fischer. The people of Nebraska have seen what a great job she is doing - and it showed up at the ballot box! #MAGA,,,,
Wed May 16 12:07:52 +0000 2018,86938,9.96724E+17,NULL,17390,Twitter for iPhone,"Congratulations to Lou Barletta of Pennsylvania. He will be a great Senator and will represent his people well - like they haven’t been represented in many years. Lou is a friend of mine and a special guy\, he will very much help MAKE AMERICA GREAT AGAIN!",,,,
Tue May 15 20:29:39 +0000 2018,48828,9.96488E+17,NULL,11877,Twitter for iPhone,Thank you to the Washington Examiner and @CortesSteve on the great article - on WINNING! https://t.co/b5dfUABN5q,,,,
Tue May 15 18:56:56 +0000 2018,49721,9.96464E+17,NULL,11165,Twitter for iPhone,#PeaceOfficersMemorialDay https://t.co/agxulpPyag,,,,
Tue May 15 18:39:58 +0000 2018,83239,9.9646E+17,NULL,18688,Twitter for iPhone,Today is one of the most important and solemn occasions of the year – the day we pay tribute to the Law Enforcement Heroes who gave their lives in the line of duty. They made the ultimate sacrifice so that we could live in safety and peace. We stand with our police (HEROES) 100%! https://t.co/XDtYRUeOk1,,,,
Tue May 15 17:30:16 +0000 2018,46387,9.96443E+17,NULL,12007,Twitter for iPhone,Nebraska - make sure you get out to the polls and VOTE for Deb Fischer today! https://t.co/bDHVaGv2FS,,,,
Tue May 15 14:08:21 +0000 2018,140443,9.96392E+17,NULL,32019,Twitter for iPhone,"Can you believe that with all of the made up\, unsourced stories I get from the Fake News Media\, together with the  $10\,000\,000 Russian Witch Hunt (there is no Collusion)\, I now have my best Poll Numbers in a year. Much of the Media may be corrupt\, but the People truly get it!",,,,
Tue May 15 12:35:30 +0000 2018,78011,9.96368E+17,NULL,14876,Twitter for iPhone,"Trade negotiations are continuing with China. They have been making hundreds of billions of dollars a year from the U.S.\, for many years. Stay tuned!",,,,
Tue May 15 12:26:59 +0000 2018,159303,9.96366E+17,NULL,21157,Twitter for iPhone,Our great First Lady is doing really well. Will be leaving hospital in 2 or 3 days. Thank you for so much love and support!,,,,
Tue May 15 12:22:10 +0000 2018,0,9.96365E+17,NULL,8108,Twitter for iPhone,RT @Scavino45: “Job openings hit record high of 6.6 million” https://t.co/BwDsLU6T4l,,,,
Tue May 15 12:21:24 +0000 2018,0,9.96365E+17,NULL,8053,Twitter for iPhone,RT @Scavino45: “Trump is putting the US back on top” https://t.co/tnYo2EAd2T,,,,
Mon May 14 21:09:16 +0000 2018,149307,9.96135E+17,NULL,22743,Twitter for iPhone,"Heading over to Walter Reed Medical Center to see our great First Lady\, Melania. Successful procedure\, she is in good spirits. Thank you to all of the well-wishers!",,,,
Mon May 14 20:46:25 +0000 2018,118557,9.9613E+17,NULL,26539,Twitter for iPhone,"The so-called leaks coming out of the White House are a massive over  exaggeration put out by the Fake News Media in order to make us look as bad as possible. With that being said\, leakers are traitors and cowards\, and we will find out who they are!",,,,
Mon May 14 20:06:53 +0000 2018,63013,9.9612E+17,NULL,12492,Twitter for iPhone,"ZTE\, the large Chinese phone company\, buys a big percentage of individual parts from U.S. companies. This is also reflective of the larger trade deal we are negotiating with China and my personal relationship with President Xi.",,,,
Mon May 14 15:16:38 +0000 2018,64468,9.96047E+17,NULL,15995,Twitter for iPhone,#USEmbassyJerusalem https://t.co/f1SFvrkcAH,,,,
Mon May 14 13:36:25 +0000 2018,167314,9.96021E+17,NULL,31824,Twitter for iPhone,Big day for Israel. Congratulations!,,,,
Mon May 14 10:54:15 +0000 2018,85368,9.95981E+17,NULL,17864,Twitter for iPhone,U.S. Embassy opening in Jerusalem will be covered live on @FoxNews &amp; @FoxBusiness. Lead up to 9:00 A.M. (eastern) event has already begun. A great day for Israel!,,,,
Mon May 14 00:03:21 +0000 2018,135139,9.95817E+17,NULL,31816,Twitter for iPhone,"So sad to see the Terror Attack in Paris. At some point countries will have to open their eyes &amp; see what is really going on. This kind of sickness &amp; hatred is not compatible with a loving\, peaceful\, &amp; successful country! Changes to our thought process on terror must be made.",,,,
Sun May 13 20:11:33 +0000 2018,125028,9.95758E+17,NULL,27863,Twitter for iPhone,"Remember how badly Iran was behaving with the Iran Deal in place. They were trying to take over the Middle East by whatever means necessary. Now\, that will not happen!",,,,
Sun May 13 19:22:03 +0000 2018,101153,9.95746E+17,NULL,19916,Twitter for iPhone,"China and the United States are working well together on trade\, but past negotiations have been so one sided in favor of China\, for so many years\, that it is hard for them to make a deal that benefits both countries. But be cool\, it will all work out!",,,,
Sun May 13 15:01:00 +0000 2018,84164,9.9568E+17,NULL,17379,Twitter for iPhone,"President Xi of China\, and I\, are working together to give massive Chinese phone company\, ZTE\, a way to get back into business\, fast. Too many jobs in China lost. Commerce Department has been instructed to get it done!",,,,
Sun May 13 12:29:08 +0000 2018,132005,9.95642E+17,NULL,29961,Twitter for iPhone,Happy Mother’s Day!!! https://t.co/zw71dnT7TJ,,,,
Sat May 12 22:20:16 +0000 2018,115894,9.95428E+17,NULL,31475,Twitter for iPhone,"The Senate should get funding done before the August break\, or NOT GO HOME. Wall and Border Security should be included. Also waiting for approval of almost 300 nominations\, worst in history. Democrats are doing everything possible to obstruct\, all they know how to do. STAY!",,,,
Sat May 12 22:02:55 +0000 2018,112009,9.95424E+17,NULL,28057,Twitter for iPhone,Iran’s Military Budget is up more than 40% since the Obama negotiated Nuclear Deal was reached...just another indicator that it was all a big lie. But not anymore!,,,,
Sat May 12 21:08:55 +0000 2018,162839,9.95411E+17,NULL,34489,Twitter for iPhone,"North Korea has announced that they will dismantle Nuclear Test Site this month\, ahead of the big Summit Meeting on June 12th. Thank you\, a very smart and gracious gesture!",,,,
Fri May 11 23:49:40 +0000 2018,94539,9.95089E+17,NULL,22854,Twitter for iPhone,"Why doesn’t the Fake News Media state that the Trump Administration’s Anti-Trust Division has been\, and is\, opposed to the AT&amp;T purchase of Time Warner in a currently ongoing Trial. Such a disgrace in reporting!",,,,
Fri May 11 23:39:01 +0000 2018,145690,9.95086E+17,NULL,31130,Twitter for iPhone,Big week next week when the American Embassy in Israel will be moved to Jerusalem. Congratulations to all!,,,,
Fri May 11 20:56:25 +0000 2018,87242,9.95045E+17,NULL,20106,Twitter for iPhone,"The American people deserve a healthcare system that takes care of them – not one that takes advantage of them. We will work every day to ensure all Americans have access to the quality\, affordable medication they need and deserve. We will not rest until the job is done! https://t.co/9BzevAniNx",,,,
Fri May 11 19:30:16 +0000 2018,92740,9.95023E+17,NULL,22444,Twitter for iPhone,"Today\, my Administration is launching the most sweeping action in history to lower the price of prescription drugs for the American People. We will have tougher negotiation\, more competition\, and much lower prices at the pharmacy counter! https://t.co/xdakX43a4d",,,,
Fri May 11 00:49:43 +0000 2018,83089,9.94741E+17,NULL,17926,Twitter for iPhone,Thank you Indiana! #MAGA🇺🇸\nhttps://t.co/fCv76VyUax,,,,
Thu May 10 14:37:57 +0000 2018,237845,9.94587E+17,NULL,62922,Twitter for iPhone,The highly anticipated meeting between Kim Jong Un and myself will take place in Singapore on June 12th. We will both try to make it a very special moment for World Peace!,,,,
Thu May 10 14:33:00 +0000 2018,301809,9.94586E+17,NULL,68865,Twitter for iPhone,Five Most Wanted leaders of ISIS just captured!,,,,
Thu May 10 14:30:27 +0000 2018,107059,9.94585E+17,NULL,26899,Twitter for iPhone,"Senator Cryin’ Chuck Schumer fought hard against the Bad Iran Deal\, even going at it with President Obama\, &amp; then Voted AGAINST it! Now he says I should not have terminated the deal - but he doesn’t really believe that! Same with Comey. Thought he was terrible until I fired him!",,,,
Thu May 10 10:01:43 +0000 2018,190559,9.94518E+17,NULL,49906,Twitter for iPhone,"On behalf of the American people\, WELCOME HOME! https://t.co/hISaCI95CB",,,,
Thu May 10 02:19:02 +0000 2018,96939,9.94401E+17,NULL,19144,Twitter for iPhone,Gina Haspel did a spectacular job today. There is nobody even close to run the CIA!,,,,
Wed May 09 22:41:03 +0000 2018,109817,9.94347E+17,NULL,18408,Twitter for iPhone,Looking forward to greeting the Hostages (no longer) at 2:00 A.M.,,,,
Wed May 09 22:38:10 +0000 2018,106024,9.94346E+17,NULL,26369,Twitter for iPhone,"The Failing New York Times criticized Secretary of State Pompeo for being AWOL (missing)\, when in fact he was flying to North Korea. Fake News\, so bad!",,,,
Wed May 09 12:35:51 +0000 2018,121081,9.94194E+17,NULL,27624,Twitter for iPhone,Secretary Pompeo and his “guests” will be landing at Andrews Air Force Base at 2:00 A.M. in the morning. I will be there to greet them. Very exciting!,,,,
Wed May 09 12:30:56 +0000 2018,168836,9.94193E+17,NULL,45129,Twitter for iPhone,"I am pleased to inform you that Secretary of State Mike Pompeo is in the air and on his way back from North Korea with the 3 wonderful gentlemen that everyone is looking so forward to meeting. They seem to be in good health. Also\, good meeting with Kim Jong Un. Date &amp; Place set.",,,,
Wed May 09 12:00:30 +0000 2018,66703,9.94185E+17,NULL,13651,Twitter for iPhone,"Congratulations to Mike Dewine on his big win in the Great State of Ohio. He will be a great Governor with a heavy focus on HealthCare and Jobs.  His Socialist opponent in November should not do well\, a big failure in last job!",,,,
Wed May 09 11:48:17 +0000 2018,137792,9.94182E+17,NULL,33578,Twitter for iPhone,"Candace Owens of Turning Point USA is having a big impact on politics in our Country. She represents an ever expanding group of very smart “thinkers\,” and it is wonderful to watch and hear the dialogue going on...so good for our Country!",,,,
Wed May 09 11:38:45 +0000 2018,120207,9.9418E+17,NULL,27761,Twitter for iPhone,"The Fake News is working overtime. Just reported that\, despite the tremendous success we are having with the economy &amp; all things else\, 91% of the Network News about me is negative (Fake). Why do we work so hard in working with the media when it is corrupt? Take away credentials?",,,,
Wed May 09 11:24:20 +0000 2018,83243,9.94176E+17,NULL,19227,Twitter for iPhone,"The Republican Party had a great night. Tremendous voter energy and excitement\, and all candidates are those who have a great chance of winning in November. The Economy is sooo strong\, and with Nancy Pelosi wanting to end the big Tax Cuts and Raise Taxes\, why wouldn’t we win?",,,,
Tue May 08 22:11:13 +0000 2018,95878,9.93977E+17,NULL,24488,Twitter for iPhone,"The Iran Deal is defective at its core. If we do nothing\, we know what will happen. In just a short time\, the world’s leading state sponsor of terror will be on the cusp of acquiring the world’s most dangerous weapons.... https://t.co/58qwBLzxIH",,,,
Tue May 08 20:33:41 +0000 2018,0,9.93952E+17,NULL,14500,Twitter for iPhone,RT @WhiteHouse: \Finally\," I want to deliver a message to the long-suffering people of Iran. The people of America stand with you.\"" https://…""",,,
Tue May 08 20:33:39 +0000 2018,0,9.93952E+17,NULL,14096,Twitter for iPhone,"RT @WhiteHouse: \At the heart of the Iran deal was a giant fiction: that a murderous regime desired only a peaceful nuclear energy program.…""",,,,
Tue May 08 18:52:00 +0000 2018,90458,9.93927E+17,NULL,27635,Twitter for iPhone,Statement on the Iran Nuclear Deal: https://t.co/O3SpryCKkc,,,,
Tue May 08 11:30:23 +0000 2018,138154,9.93815E+17,NULL,33731,Twitter for iPhone,"John Kerry can’t get over the fact that he had his chance and blew it! Stay away from negotiations John\, you are hurting your country!",,,,
Tue May 08 11:22:53 +0000 2018,86673,9.93813E+17,NULL,17027,Twitter for iPhone,"I will be speaking to my friend\, President Xi of China\, this morning at 8:30. The primary topics will be Trade\, where good things will happen\, and North Korea\, where relationships and trust are building.",,,,
Tue May 08 11:09:23 +0000 2018,91660,9.9381E+17,NULL,20725,Twitter for iPhone,"Gina Haspel\, my highly respected nominee to lead the CIA\, is being praised for the fact that she has been\, and alway will be\, TOUGH ON TERROR! This is a woman who has been a leader wherever she has gone. The CIA wants her to lead them into America’s  bright and glorious future!",,,,
Mon May 07 18:44:32 +0000 2018,111859,9.93562E+17,NULL,27350,Twitter for iPhone,I will be announcing my decision on the Iran Deal tomorrow from the White House at 2:00pm.,,,,
Mon May 07 17:20:50 +0000 2018,67219,9.93541E+17,NULL,13889,Twitter for iPhone,"National Prescription Drug #TakeBackDay numbers are in! Another record broken: nearly 1 MILLION pounds of Rx pills disposed! Let’s keep fighting this opioid epidemic\, America!",,,,
Mon May 07 14:08:37 +0000 2018,118444,9.93493E+17,NULL,33028,Twitter for iPhone,The United States does not need John Kerry’s possibly illegal Shadow Diplomacy on the very badly negotiated Iran Deal.  He was the one that created this MESS in the first place!,,,,
Mon May 07 13:35:32 +0000 2018,95113,9.93484E+17,NULL,23371,Twitter for iPhone,"Is this Phony Witch Hunt going to go on even longer so it wrongfully impacts the Mid-Term Elections\, which is what the Democrats always intended? Republicans better get tough and smart before it is too late!",,,,
Mon May 07 13:29:49 +0000 2018,87664,9.93483E+17,NULL,21678,Twitter for iPhone,"Lisa Page\, who may hold the record for the most Emails in the shortest period of time (to her Lover\, Peter S)\, and attorney Baker\, are out at the FBI as part of the Probers getting caught? Why is Peter S still there? What a total mess. Our Country has to get back to Business!",,,,
Mon May 07 13:05:44 +0000 2018,65137,9.93477E+17,NULL,11874,Twitter for iPhone,"Good luck to Ric Grenell\, our new Ambassador to Germany. A great and talented guy\, he will represent our Country well!",,,,
Mon May 07 13:00:18 +0000 2018,58674,9.93476E+17,NULL,12422,Twitter for iPhone,“The Great Revolt” by Salena Zito and Brad Todd does much to tell the story of our great Election victory. The Forgotten Men &amp; Women are forgotten no longer!,,,,
Mon May 07 11:39:53 +0000 2018,110027,9.93455E+17,NULL,29963,Twitter for iPhone,The 13 Angry Democrats in charge of the Russian Witch Hunt are starting to find out that there is a Court System in place that actually protects people from injustice...and just wait ‘till the Courts get to see your unrevealed Conflicts of Interest!,,,,
Mon May 07 11:27:34 +0000 2018,90295,9.93452E+17,NULL,21599,Twitter for iPhone,"The Russia Witch Hunt is rapidly losing credibility. House Intelligence Committee found No Collusion\, Coordination or anything else with Russia. So now the Probe says OK\, what else is there? How about Obstruction for a made up\, phony crime.There is no O\, it’s called Fighting Back",,,,
Mon May 07 11:04:47 +0000 2018,92738,9.93447E+17,NULL,24905,Twitter for iPhone,"My highly respected nominee for CIA Director\, Gina Haspel\, has come under fire because she was too tough on Terrorists. Think of that\, in these very dangerous times\, we have the most qualified person\, a woman\, who Democrats want OUT because she is too tough on terror. Win Gina!",,,,
Mon May 07 10:53:49 +0000 2018,59710,9.93444E+17,NULL,14986,Twitter for iPhone,"To the great people of West Virginia we have\, together\, a really great chance to keep making a big difference. Problem is\, Don Blankenship\, currently running for Senate\, can’t win the General Election in your State...No way! Remember Alabama. Vote Rep. Jenkins or A.G. Morrisey!",,,,
Sat May 05 21:35:50 +0000 2018,77424,9.92881E+17,NULL,16132,Twitter for iPhone,"Thank you Cleveland\, Ohio! https://t.co/ROEFRLY7jP",,,,
Sat May 05 00:31:30 +0000 2018,81030,9.92562E+17,NULL,17531,Twitter for iPhone,"Our high level delegation is on the way back from China where they had long meetings with Chinese leaders and business representatives. We will be meeting tomorrow to determine the results\, but it is hard for China in that they have become very spoiled with U.S. trade wins!",,,,
Sat May 05 00:17:34 +0000 2018,97524,9.92559E+17,NULL,18366,Twitter for iPhone,"Just returned home to the beautiful White House\, from Dallas\, where the Arena was packed to the rafters with the great fans and supporters of the @NRA. It was so wonderful to be there!",,,,
